Species.ID,Ecol.Imp.Score,Ecol.Imp.Docu,Ecol.Imp.Sources,Ecol.Imp.Text,Scope.Score,Scope.Docu,Scope.Distribution,Scope.Sources,Scope.Text,Inv.Potl.Score,Inv.Potl.Docu,Inv.Potl.Established,Inv.Potl.Sources,Inv.Potl.Text,Mgt.Diff.Score,Mgt.Diff.Docu,Mgt.Diff.Sources,Mgt.Diff.Text
375,3,COMP PR/RE,Ref009,Fouling organism; probably competes for space with other invertebrates; forms dense monospecific aggregations which affects other animals in the habitat,4,COMP PR/RE,Locally pervasive,Ref009,,1,COMP PR/RE,No,Ref009,Contributing to its success as an invader is the chaetopterids power of regeneration. Any single segment from among the first 14 can regenerate anteriorly and posteriorly to produce a complete worm.,U,,,
376,1,COMP PR/RE,Ref009,Fouling organism; ecological impacts are unstudied but presumed to be minimal.,4,COMP PR/RE,Locally patchy,Ref009,,1,COMP PR/RE,No,Ref009,A fouling organism requiring assisted transport to expand alien range.,U,,,
377,1,COMP PR/RE,Ref009,Fouling organism; ecological impact unstudied but presumed to be minimal.,4,COMP PR/RE,Regionally pervasive,Ref009,,1,COMP PR/RE,No,Ref009,A fouling organism requiring assisted transport to expand alien range. These worms may reproduce asexually by transverse division providing faster establishment.,U,,,
378,1,COMP PR/RE,Ref009,"Fouling organism; ecological impact is so far unstudied, but observations suggest competition for space with other invertebrates.",4,COMP PR/RE,Regionally pervasive,Ref009,Considered widespread where it is found,1,COMP PR/RE,No,Ref009,A fouling organism requiring assisted transport to expand alien range.,U,,,
379,1,COMP PR/RE,Ref009,"Fouling organism; ecological impacts unstudied in Hawaii. Before a die-off in the early 1970s, these oyster formed extensive dense beds in the estuarine areas of Pearl Harbor which undoubtedly affected the native benthic communities there.",4,COMP PR/RE,Locally patchy,Ref009,,1,COMP PR/RE,No,Ref253,"Larvae reported to exploit tidal transport systems. Delaware Bay studies show larval spreading in definite lanes upstream and downstream from adult populations, some found to set 20 miles upstream from the adults.",U,,,
380,1,COMP PR/RE,Ref009,A notoriously stubborn fouling species; adults are very difficult to remove from ships hulls. Ecological impacts are unstudied but presumed to be minimal.,4,COMP PR/RE,Locally patchy,Ref009,Only found in Hawaii and its native range,1,COMP PR/RE,No,Ref009,A stubborn fouling species.,U,,,
381,1,COMP PR/RE,Ref009,"Fouling organism; ecological impacts unstudied, although some competition with native intertidal species is likely.",4,COMP PR/RE,Locally patchy,Ref009,,2,COMP PR/RE,No,Ref009,"A fouling organism requiring assisted transport to expand alien range.  It is probably now much more widespread, but goes unreported.",U,,,
382,1,COMP PR/RE,Ref009,"A major fouling species; ecological impacts are unstudied in Hawaii
Hulls of ships, buoys, and inflow pipes of desalination plants become covered with the barnacles (Mangum, et al., 1972; Starostin, 1968) which causes corrosion of the metals and increased maintenance costs. Barnacle aggregations also increase friction between the surface of ships' bottoms and surrounding water, thus travel costs are increased and efficiency decreased, because it requires additional energy to move the ship at the same speed (London, 1972). (http://nis.gsmfc.org/nis_factsheet.php?toc_id=120)",4,COMP PR/RE,Locally patchy,Ref009,Throughout the globe.,2,COMP PR/RE,No,"Ref019, Ref073","Potential for spread in ballast water/ships hulls. Spread to (Pacific Coast, USA) bays without cargo ports was probably through hull fouling or through larvae carried in currents along the coast.",4,COMP PR/RE,Ref019,Irreversible where established. Can be controlled in desalination plant with chlorination and high temps.
383,1,COMP PR/RE,"Ref009, Ref265","A nuisance fouler, fouling oysters in Alabama, which increases labour costs for market preparation. Balanus species may also cause significant changes to ecological processes by increasing the area and volume available for associated fauna, thereby causing changes to food webs. There is some spatial competition with other species",4,COMP PR/RE,Locally patchy,Ref009,,1,COMP PR/RE,No,Ref009,,4,PR,Ref266,Some success with slimicides in cooling water systems. Toxic chemicals unsuitable for systems harboring beneficial marine organisms.
384,1,COMP PR/RE,Ref009,Fouling species; spatial competition with other native and non-native species in high intertidal zones likely.,4,COMP PR/RE,Locally patchy,Ref009,,2,COMP PR/RE,No,"Ref009, Ref208","A fouling organism requiring assisted transport to expand alien range. Now common on many ship and barge hulls in Hawaii, and on some which travel throughout the Pacific. It seems only a matter of time until this barnacle further invades the Pacific region.
Larvae unlikely to survive long-term transport in ballast water.",U,,,
385,1,COMP PR/RE,"Ref009, Ref267","Fouling organism; 
The ecological impacts are unstudied; if it becomes established in protected coastal areas it has the potential to overgrow coral reefs.",4,COMP PR/RE,Locally patchy,Ref009,,1,COMP PR/RE,No,Ref009,Potential for transport in ships fouling communities or ballast water.,4,RE,Ref267,The control of the dispersal of this species is the only management action available.
395,1,COMP PR/RE,Ref009,"Fouling organism; ecological impact unstudied, but spatial competition in shallow water and fouling communities is likely.",4,COMP PR/RE,Locally patchy,Ref009,,1,COMP PR/RE,No,Ref009,A fouling organism requiring assisted transport to expand alien range.,U,,,
396,1,COMP PR/RE,Ref009,"Fouling organism; ecological impact unstudied, but spatial competition in shallow water and fouling communities is likely.",4,COMP PR/RE,Locally patchy,Ref009,,1,COMP PR/RE,No,Ref009,A fouling organism requiring assisted transport to expand alien range.,U,,,
397,1,COMP PR/RE,Ref009,"Fouling organism; ecological impact unstudied, but spatial competition in shallow water and fouling communities is likely.",4,COMP PR/RE,Locally patchy,Ref009,,1,COMP PR/RE,No,Ref009,A fouling organism requiring assisted transport to expand alien range.,U,,,
472,3,COMP PR/RE,"Ref016, Ref002","Voracious feeders - consume zebra mussel. Aggressive, successful competitor. Prey for sturgeon, pike, pikeperch - all commercially important in Black and Caspian Seas. Outcompete & eat eggs of most benthic competitors. Fuller and Benson (2003) state that, ""the numbers of native fish species have declined in areas where N. melanostomus has become abundant. Immediate threat to trout pops. eats bivalves that filter water, and becomes a vector of bioaccumulation, with contaminants becoming passed on to the larger game fish or humans that eat them.
Tolerant to wide ranges of salinity and oxygen levels, extremely prolific, iteroparous (3x p/season), 5K eggs @ once. In 1989 no gobies caught in St. Clair River delta - by spring 1990 they composed bulk of catch.",4,COMP PR/RE,Regionally pervasive,Ref016,Spread through Northern Europe,4,COMP PR/RE,No,Ref016,Potential to expand introduced range via streams and watercourses.,4,COMP PR/RE,"Ref016, Ref002",Considered high priority to keep from escaping Great Lakes. Effectiveness of current electronic barriers undetermined. Illegal to use as bait in Great Lakes. Little information on successful management options for this species.
473,1,COMP PR/RE,Ref016,"Active hunters/ambush predators likely to affect population size of their prey & availability of food sources for larger fish in the Atlantic.
No referenced problems w/introduction or existing populations at this time.",4,COMP PR/RE,Locally patchy,Ref016,,1,COMP PR/RE,No,"Ref016, Ref002",Mainly human assisted introductions. Ballast water and intentional aquarium release are main transport vectors. Some potential for natural expansion from introduced ranges.,U,COMP PR/RE,Ref016,No information on attempts to eradicate from non-native habitats.
474,3,COMP PR/RE,Ref016,"In 1996 Atlantic salmon escapees = 0.004% of yearly Pacific salmon catch. Fear of genetic alteration of native populations that may threaten viability, reduce fitness & disrupt genetic diversity. Possibility of interbreeding, competition, disease, parasitism, but these have not occurred yet.",4,COMP PR/RE,Regionally pervasive,Ref016,.,1,COMP PR/RE,Yes,Ref016,Repeated failures to introduce Atlantic Salmon in this region and continued high mortality suggest that there is little threat either of interbreeding or challenging indigenous populations.,2,COMP PR/RE,Ref016,
486,4,COMP PR/RE,Ref016,"Filter up to 1 liter of water per day, clearing it of plankton & bio-accumulate substances such as PCB's that can enter the food chain in dangerous levels.  Industrial: They clog water treatment/intake systems, causing slow-downs and stoppages.  Recreation: they affect docks and boat engines, sometimes causing overheating & their sharp edges make beaches less desirable. Disrupt food chains/crowd out native mussels.
Zebra mussels settle in high numbers on native mussels (Unionidaceae), causing suffocation, starvation, and energetic stress leading to death. Loss of native mussel populations has increased dramatically where zebra mussels are present, particularly in the Great Lakes and Hudson and Mississippi rivers. 
Spawning reefs of fishes such as lake trout are negatively affected by zebra mussel colonies.",4,COMP PR/RE,Regionally pervasive,Ref016,,3,COMP PR/RE,No,Ref019,"Horizontal dispersal (of veligers in plankton) is passive and dependent on water currents. Attach to floating debris/vegetation. Populations spawning upstream provide potential for downstream dispersal.
Spread worldwide in ballast.",4,COMP PR/RE,Ref016,"Experimentation w/hot water to control. Est costs to control, repair damage could be billions annually. Black goby also a native of the Black and Caspian Seas was also introduced to the Great Lakes and preys upon D. polymorpha."
282,3,COMP PR/RE,Ref006,"Economic costs to shellfish industry, toxins build up in shellfish and affect humans, causes mortatilty of other coastal fish",4,COMP PR/RE,Regionally patchy,"Ref006, Ref687",Found in two subregions within adjacent ecoregions.,3,RE,No,"Ref002, Ref687","May be transported in water currents, ballast water and solid ballast.",4,RE,Ref002,No known controls for this organism. Prevention is key to reducing toxic outbreaks.
295,2,COMP PR/RE,Ref006,Fouling; slight alteration of sediment communities. May displace native species through competition for food and space.,4,COMP PR/RE,Regionally patchy,Ref006,Occurs in two ecoregions that are distant from each other,1,COMP PR/RE,No,Ref006,"Reported as a hull fouling species, with potential for natural dispersal from introduced range, possibly attached to floating objects.",4,COMP PR/RE,Ref006,One management option listed - change in salinity. No effective eradication methods.
297,2,COMP PR/RE,Ref006,"Habitat modification; reduction in native species populations.
The New Zealand screw shell is a threat to other seafloor species because it breeds so prolifically, smothering the sea floor, down to eighty metres depth along the Continental Shelf.",3,COMP PR/RE,Regionally pervasive,Ref006,,3,COMP PR/RE,No,Ref006,"It has colonised more habitat than any other high-impact benthic marine pest in Australia and its wide temperature and depth tolerance makes further spread likely in the planktonic stage. A review of the Turritellidae (Marwick 1956) suggested that the multispiral protoconch (3-4 whorls) indicates a long pelagic existence in the veliger stage (indirect development). This stage would enable widespread current-enhanced dispersal of M. roseus.
It is not clear whether its spread up Australia’s east coast was a natural dispersal in prevailing currents, or whether its spread was facilitated by other vectors such as fishing vessels and dredges.
Now covers an area of the seafloor about the size of Tasmania.",4,COMP PR/RE,Ref006,
298,2,COMP PR/RE,Ref006,"Modifies sediment dynamics through the building of mud tubes on the sediment surface consolidating the sediments (Myers, 1977). Facilitates transmission of new pathogens. 
It is common in areas of high turbidity, especially in areas with high organic pollution levels where it can reach high densities.
Parasites have been found on C. insidiosum in German waters, but it is unknown whether these could transfer to native species and cause negative impacts.",4,COMP PR/RE,Regionally pervasive,Ref006,,1,COMP PR/RE,No,"Ref006, Ref260",An fouling organism requiring assisted transport to expand alien range. Thought to have spread to the North Pacific from the North Atlantic via commercial vessels (Bousfield and Hoover 1997).,4,COMP PR/RE,Ref006,"Eradication unlikely in marine environment with no known predators. Fouling control options include chemical (copper compounds, DDT, Hydrocarbons) and UV radiation and blue light."
299,2,COMP PR/RE,Ref006,Modifies sediment habitats; fouling,4,COMP PR/RE,Regionally pervasive,Ref006,In two different but close ecoregions,2,COMP PR/RE,No,"Ref261, Ref223","A fouling organism requiring assisted transport to expand alien range. Has not been found outside Lyttelton Harbour (New Zealand), the original site of invasion.
Washed ashore in The Netherlands on holdfasts of Himanthalia and on Bucinumeggs.",4,COMP PR/RE,Ref223,Permanently established in European and Dutch waters.
300,3,COMP PR/RE,Ref006,"Negative habitat modifications; burrowing into human-made structures; aquaculture pest
High levels of P. ciliata infestation tended to weaken the shells of Mtilus edulis.
This species is a serious oyster and mussel pest, as it burrows into shells, weakening them and making them more prone to predation by organisms such as crabs. It is also able to alter habitats by increasing the amount of mud in an area (due to burrowing activities). This mud can eliminate native flora and fauna.",4,COMP PR/RE,Regionally patchy,Ref006,,3,COMP PR/RE,No,"Ref006, Ref090","Larvae are believed to have a pelagic life from 2 -6 weeks before settling (Fish & Fish, 1996). Larvae of Polydora ciliata have been collected as far as 118km offshore (Murina, 1997) and along the Belgian coast were found in the plankton all year round with a peak in the summer (Daro & Polk 1973).",4,COMP PR/RE,Ref006,Copper compounds suggested for control of fouled surfaces. No known eradications for established populations.
301,3,COMP PR/RE,Ref006,Negatively modifies habitat with its large densitys; losses in aquaculture,4,COMP PR/RE,Regionally pervasive,Ref006,,2,PR,No,Ref099,"Larvae are planktonic for 4-47 days and could be an important transportation vector for long distance dispersal.
Drift tube recoveries and larval abundances in the plankton indicate that few Pseudopolydora larvae leave Mission Bay, (San Diego) but that longshore currents can carry those which do to other suitable bay habitats.",3,COMP PR/RE,Ref006,No known natural predators. No effective non-toxic eradication controls in marine environment. Chemical applications of copper compounds used to prevent fouling.
302,3,COMP PR/RE,"Ref006, Ref262, Ref002","There is some evidence to suggest that dense beds of S. spallanzanii may intercept settling organic material and thus interfere with nutrient cycles. At high densities, it may impact other filter feeding organisms.
This large sabellid (80-400 mm in length) forms dense colonies and markedly modifies local water currents and rates of sediment deposition.
Positive ecological roles may include providing sewage bioremediatioin (Stabilia et al. 2006), and as food for leatherjackets in aquaria.
It may also inflict economic damage by competing with mussels and oysters in aquaculture farms.",4,COMP PR/RE,Regionally patchy,Ref006,,3,COMP PR/RE,No,"Ref006, Ref068, Ref262","Possibility of range expansion through natural dispersal. The presence of a toxin in fan worm tissue may prevent native predators from controlling invasive populations.
S. spallanzanii has extended its range through out the entire 2000 km 2 (Port Phillip Bay, Australia) embayment, and has invaded most subtidal habitats. The most recent dive survey (1998) indicates that S. spallanzanii has extended its range through out the entire 2000 km 2 embayment, and has invaded most subtidal habitats.",4,COMP PR/RE,Ref002. Ref262,"Physical, manual removal effective for new, small infestations. Able to regenerate from small fragments so care to remove entire organism is key."
303,2,COMP PR/RE,"Ref006, Ref065","Loss of aquaculture/commercial/recreational harvest.
Found in high densities up to 12, 521 per square metre on heavily fouled mariculture cages (Mak et al. 1985).
May endanger habitat restoration effects.",4,COMP PR/RE,Regionally pervasive,Ref006,,1,COMP PR/RE,No,Ref065,A fouling organism requiring assisted transport to expand alien range.,U,,,
304,2,COMP PR/RE,Ref006,"Causes losses in aquaculture; resource and spatial competition with native species.
Has replaced native solitary tunicates, Pyura haustor and Ascidia ceratodes (Lambert and Lambert 1995).",4,COMP PR/RE,Regionally pervasive,Ref006,,1,COMP PR/RE,No,Ref002,Potential for short distance planktonic larval dispersal. Plankton larvae settle quickly. Long term dispersal requires human assistance.,2,COMP PR/RE,Ref006,"Established in San Diego, but 30 years after its introduction it still had not become abundant (Lambert and Lambert 1995)."
305,1,COMP PR/RE,"Ref006, Ref314","Impact is great upon man-made wooden structures, but not upon ecosystems necessarily. A single introduced organism, the shipworm Teredo navalis, caused $615 million (in 1992 dollars) of structural damage to maritime facilities in 3 years in the early part of the 20th century.
Shipworms feed on wood particles and minute organisms. They do enormous damage to piers and ships and were death to the ships that cruised the oceans of the world. They are particularly bad in the warm tropical waters of the Caribbean Sea.
Shipworms are of major ecological significance, in that they break
down organic material in the sea that has originated on land. This is
particularly important in tropical regions with mangroves, where the
large quantities of organic matter accumulating would otherwise take
much longer to decompose.",4,COMP PR/RE,Regionally pervasive,Ref006,,3,COMP PR/RE,No,"Ref006, Ref263",Shipworms release planktonic veliger larvae (larvae that have developed swimming membranes or velum). The larvae exist in the water column for two or three weeks before settling. Potential for spread through tidal or ocean currents and on driftwood.,3,COMP PR/RE,"Ref006, Ref263","Chemical, manual, physical treatments. Prevention with copper coating effective."
306,3,COMP PR/RE,Ref006,Incredibly successful competitor; dominates ecosystem and significantly reduses biodiversity.,4,COMP PR/RE,Regionally patchy,Ref006,,1,COMP PR/RE,No,"Ref006, Ref444","Introductions attrributed to ballast water and solid ballast exchange. Establishes quickly within a short time of its arrival.
Recovers quickly from disturbances, such as summer anoxic events.",U,RE,Ref264,Crab predation may control T. lubrica in New Zealand waters.
307,1,COMP PR/RE,"Ref006, Ref102","Significant fouling organism; provides suitable surface for other fouling species. Resistant to fouling paints, providing a surface for other fouling organisms, which would otherwise not be able to survive.",4,COMP PR/RE,Regionally pervasive,Ref006,,1,COMP PR/RE,No,Ref102,A fouling organism requiring assisted transport to expand alien range.,4,COMP PR/RE,Ref102,Resistant to toxic paints. Currently no established control measures.
757,3,PR,"Ref316, Ref317","A known bioeroder (e.g.Rehm and Humm 1973; Carlton 1979; Perry and Brusca1989; El-Shanshoury et al. 1994).
A threat to mangrove forests. The isopod may play an important role in determining the lower intertidal limits of (the red mangrove) Rhizophora mucronata.
It has been suggested that S. terebrans was causing an ""eco-catastrophe"" by destroying the aerial roots of red mangroves(Rhizophora mangle L.) along the southwestern coast of Floridato such an extent that the Ten Thousand Islands and mangrovefringes of the mainland were steadily shrinking (15). Similarly,it was concluded that the isopods were a serious threat to themangroves of the Kerala coast, India (16).",4,PR,Locally pervasive,Ref316,,1,PR,No,Ref317,Appear to have been spread anthropogenically around the world in or on the hulls of ships (Carlton and Iverson 1981; Morton 1987; Carlton and Ruckelshaus 1997).,4,PR,Ref316,No current permanent controls for this species.
758,2,COMP PR/RE,Ref034,"It grows in colonies formed by hundreds of individual zooids. In the competition for space, the more aggressive species stolon becomes larger when needed depending upon the thickness and size of the colony being overtaken.
It encrusts hard surfaces, excluding or inhibiting settlement by native species.",4,COMP PR/RE,Locally pervasive,Ref034,,1,COMP PR/RE,No,Ref034,"Human assisted translocations. Believed to have been brought to the Puget Sound with the Japanese Oyster, Crassostrea gigas.",4,COMP PR/RE,Ref034,No known controls in aquatic environment.
759,1,COMP PR/RE,Ref319,Feeds on arborescent bryozoans which are part of the 'fouling community'. May impact native species.,4,COMP PR/RE,Locally patchy,Ref319,,2,COMP PR/RE,No,Ref230,A fouling organism requiring assisted transport to expand alien range.,U,COMP PR/RE,,
760,1,COMP PR/RE,Ref073,Known to consume invasive Diadumene lineata in San Francisco Bay.,4,COMP PR/RE,Locally patchy,Ref073,,2,COMP PR/RE,No,Ref037,A fouling organism requiring assisted transport to expand alien range. Probably transported on ships hulls from the Caribbean area.,4,COMP PR/RE,Ref073,No known controls in aquatic environment.
761,4,COMP PR/RE,Ref321,"Dispersed by planktonic larvae, the larvae settle and construct extensive burrow systems in wooden structures (e.g., boat hulls, marinas, docks, and pilings). Cohen and Carlton (1995) report that shipworms caused $615 million in damage in San Francisco Bay during a 1920’s outbreak.",4,COMP PR/RE,Locally patchy,Ref321,,1,RE,No,Ref321,A fouling organism requiring assisted transport to expand alien range.,3,RE,Ref321,"Effective control of these pests can be accomplished by chemical treatment (e.g., creosote) or use of alternative materials (Highley 1999)."
762,1,COMP PR/RE,Ref073,"Berman and Carlton (1991) found that its diet was similar to that of the native saltmarsh snails Assiminea californica and Littorina subrotundata in Coos Bay, Oregon. They did not, however, find evidence that Myosotella myosotis is competitively superior, and concluded that its establishment was not accomplished at the expense of the native snails.",4,COMP PR/RE,Locally patchy,Ref073,"Reported as invasive along costs of South Africa, Australia, New Zealand, -no location detail provided.",1,COMP PR/RE,No,Ref073,"No pelagic larvae, so must be spread on materials, or in solid ship ballast, or with live oyster shipments.",4,COMP PR/RE,Ref073,No known controls reported. Consumed by native species in some localities.
763,1,COMP PR/RE,Ref037,The best black pearls are produced by P. margaritifera. Shells used to make jewelry and buttons. No known adverse impacts.,4,COMP PR/RE,Locally patchy,Ref037,"An Italian company imported P. margaritifera in 1860 for pearl production, but no records of escape or populations in Italy at this time.",1,COMP PR/RE,No,Ref137,Florida unintentional introduction possible as larvae in ballast or fouling communities.,2,COMP PR/RE,Ref037,No known controls in aquatic environment.
764,2,COMP PR/RE,Ref063,"Can attain high densities in non-native ecosystems and become dominant members of the benthic infauna (Larsen, 1978; Lopez Gappa et al., 2001).",4,COMP PR/RE,Locally patchy,Ref063,,1,COMP PR/RE,No,Ref063,,4,COMP PR/RE,Ref063,
765,1,COMP PR/RE,Ref323,"Since it is not known from the Gulf of Mexico other than on oil platforms, this represents a rapid range expansion following oil platform placements.",4,COMP PR/RE,Locally patchy,"Ref323, Ref233",,2,COMP PR/RE,No,"Ref323, Ref233","The range expansion into the Gulf of Mexico is likely due to a preference of this species for artificial substrates, which may be rapidly colonized.
Potential for future distribution on oil tanker fouling communities.
insensitivity to angles of recruitment and its tolerance for different depths makes it an organism with great ecological tolerance, with a potential to colonize new areas and increase its current range in Brazil's coastal waters.",4,COMP PR/RE,Ref323,No known controls in aquatic environment.
