Species.ID,Ecol.Imp.Score,Ecol.Imp.Docu,Ecol.Imp.Sources,Ecol.Imp.Text,Scope.Score,Scope.Docu,Scope.Distribution,Scope.Sources,Scope.Text,Inv.Potl.Score,Inv.Potl.Docu,Inv.Potl.Established,Inv.Potl.Sources,Inv.Potl.Text,Mgt.Diff.Score,Mgt.Diff.Docu,Mgt.Diff.Sources,Mgt.Diff.Text
283,3,COMP PR/RE,"Ref006, Ref073","Detrimental habitat modification and effects on fishing industry.
B. schlosseri can overgrow other attached, filter-feeding organisms and compete with them for food. It is a nuisance fouler on boat hulls and equipment, and can overgrow and compete with cultured oysters and mussels and increase processing costs for these shellfish.",4,COMP PR/RE,Regionally pervasive,Ref006,Found in ecoregions across the world.,1,RE,No,Ref073,"A fouling organism requiring assisted transport to expand alien range. Oyster aquaculture, hull fouling, most common forms of transport. Ballast unlikely because larvae spend less than a day in plankton before settling, but colonies possibly carried on bits of floating debris in ballast. Eckman (1953) suggested bicoastal appearances may be due to transoceanic drift on seaweed.",3,PR,Ref035,"May be removed, but eradication unlikely."
284,1,COMP PR/RE,"Ref006, Ref009","Fouling of ship's bottoms and other substratum - nuisance, Fouling organism; ecological impact thus far unstudied, but spatial competition with native species is likely. It is the source of a novel chemical, bryostatin, which has been shown been effective against leukemia.",4,COMP PR/RE,Locally patchy,"Ref006, Ref009",Pervasive in North America and Eastern Asia,1,COMP PR/RE,No,Ref073,"A fouling organism requiring assisted transport to expand alien range. (Aquaculture, ships hulls). Coronate larvae typically spend less than 10 hours in plankton before settling, through transport as tiny colonies attached to floating material in ballast tanks is possible)",3,PR,Ref254,Some success with copper antifouling and control painting surfaces.
285,3,COMP PR/RE,"Ref006, Ref002","Preys upon and dominates native species; also has visible negative effects on habitat and fisheries. The crab is able to crush mussels and shows a clear potential to negatively threaten mussel farms.
The voracious predator in some locations of its introduced range, has caused the decline of other crab and bivalve species.",4,COMP PR/RE,Regionally pervasive,Ref006,Found in long stretches across ecoregions,4,COMP PR/RE,No,Ref213,"Research data strongly suggest that the introductions to Oregon, Washington and British Columbia occurred through larval transport via strong ocean currents associated with an unusually large El Nino event in 1997 and 1998. In addition, spatial data on captured European green crabs in Willapa Bay and Grays Harbor suggest that Coriolis forces may have influenced larval transport by deflecting planktonic European green crab larvae to the south entrance of each bay mouth.",3,COMP PR/RE,"Ref070, Ref213","Numerous management techniques suggested, including restrictions and more stringent shellfish importation regulations. Requires significant ongoing management."
286,4,COMP PR/RE,Ref006,Negative affects on aquaculture and native species; destruction of habitat; fouling,4,COMP PR/RE,Regionally patchy,Ref006,Found in a variety of ecoregions all over the world.,1,RE,No,Ref030,A fouling organism requiring assisted transport to expand alien range.,2,RE,Ref070,Antifoulants (TBT and novel modern coatings) and copper compounds.
287,3,COMP PR/RE,Ref006,Extremely successful competitors in native populations; can cause economic damage as a result,4,COMP PR/RE,Regionally pervasive,"Ref006, Ref663",,3,COMP PR/RE,No,"Ref006, Ref663","The fertilization of spawned eggs in open waters is followed by pelagic development of larvae, accompanied by dispersal sometimes far from the mother population. A fouling organism transported on ships hulls to expand alien range. Larvae transported in ballast water.",4,COMP PR/RE,"Ref006, Ref663",No known effective eradication in marine waters.
288,3,COMP PR/RE,"Ref006, Ref005","Fouling of pipes; causes changes in species compositions.
Smith et al. (2002) described  C. caspia as a 'benthic colonial predator' that preys upon chronomids and other larval insects. The ecological impacts of C. caspia, however, have not yet been thoroughly studied. Uncolonized substrate introduced to C. caspia and subsequently colonizied had different realtive abundances of other invertebrates as compared to substrates not colonized by C. caspia (Ruiz et al. 1999). Other studies have suggested that C. caspia may contribute to a restructuring of benthic and pelagic freshwater communities (Folino 1999).",4,COMP PR/RE,Regionally pervasive,Ref006,,1,COMP PR/RE,No,Ref005,"An organism requiring assisted transport to expand alien range. A common aquairum species - released into Lake Erie (Mills et al. 1993). Ballast water in Washington (Ruiz and Hines 1997).
May reproduce asexually by budding to establish firm presence in introduced regions. Fragmentation of the colony may be an important factor in dispersal. Rafting on floating debris as dormant stages or reproductive adults, together with their potentially long life span may have allowed hydroids to disperse over a wide area in the long term.",4,COMP PR/RE,"Ref005, Ref006, Ref090",No known controls in marine/freshwater environments once established. Preyed upon by nudibranchs.
289,3,COMP PR/RE,"Ref006, Ref002","Fouling; degradation of native habitat; domination over native species.
It has been documented destroying habitat and causing eutrophication of the water bodies it invades.
Causes fouling of cooling water systems and is a major problem in power stations.",4,COMP PR/RE,Regionally pervasive,Ref006,,4,RE,No,"Ref037, Ref012, Ref002","Intentional introductions for aquaculture.
Genetic evidence shows that spatfall in the River Teign originated from French stock (Child, Papageorgiou & Beaumont 1995), although it is unclear whether this was from adult specimens discarded at English sites or from larvae that crossed from the French side of the channel. Should the latter be the case, it would appear that, under favourable conditions for larval development, Crassostrea gigas has the capacity to spread substantial distances.
C. gigas is well known for its tendency to colonize areas of coastline many kilometers away from its parent organisms. Spat have been documented spreading up to 1,300 km on ocean currents.",4,COMP PR/RE,"Ref006, Ref002",No physical or biological controls are feasible which would not also harm other components of marine ecosystems.
290,2,COMP PR/RE,"Ref006, Ref073",One of the most competitive fouling organisms in ports and harbours.,4,COMP PR/RE,Regionally pervasive,Ref006,,1,COMP PR/RE,No,Ref073,A fouling organism requiring assisted transport to expand alien range.,4,,Ref073,No known effective eradication controls. Hull cleaning aids in prevention of spread.
291,1,COMP PR/RE,Ref006,Fouling,4,COMP PR/RE,Regionally pervasive,Ref006,,1,RE,No,Ref006,A fouling organism requiring assisted transport to expand alien range.,U,,,
292,2,COMP PR/RE,"Ref006, Ref257","Outcompetes native species; changes tube building consolidates sediments, thereby altering the habitat for other organisms. 
Has become abundant in Port Phillip Bay, Australia and are contributing to long-term and probably irreversible changes to the ecology of Port Phillip Bay. Densities exceed 2000/sq. m in Portland Harbour.",3,COMP PR/RE,Regionally pervasive,Ref006,,1,RE,No,Ref256,"A fouling organism requiring assisted transport to expand alien range. However, there is some concern that tidal flushing may also be responsible for localized spreading of this invasive from introduced sites in alien habitats.",4,PR,Ref257,"Considered long term and probably irreversible changes to the ecology of Port Phillip Bay, Victoria, Australia. No known predators."
293,2,COMP PR/RE,Ref006,G. catenatum is the only known unarmoured dinoflagellate that produces toxins responsible for PSP (Paralytic Shellfish Poisoning). Causes economic losses to fisheries; risk to human health.,4,COMP PR/RE,Regionally pervasive,Ref006,Pervasive when it blooms,4,COMP PR/RE,No,Ref002,"A nektonic species (capable of independently moving about the water column and currents) G. catenatum is found in bays and estuaries throughout the world. Additinally transported by ignorant possession through aquaculture, fisheries activities, ballast water.",4,COMP PR/RE,Ref006,"No means of eradication in marine environment. Control options to prevent fouling of hulls and aquaculture equipment include electrical barriers/shock, salinity changes, heated water treatments, copper compounds, hydrogen peroxide, chlorine & UV radiation"
294,4,COMP PR/RE,Ref006,"Extremely pervasive fouling; outcompetes native species; dramatic alteration of ecosystem.
An example of this is an oyster fishery in Japan, where H. elegans is said to have caused the death of 60% of stocks, causing a loss of 300 million Yen. The fouling habit of this species also causes problems for seawater piping systems.",4,COMP PR/RE,Regionally pervasive,Ref006,,1,PR,No,Ref258,"Larvae persist in plankton allowing wider distribution through waves and currents. Adults also found adhering to certain seaweeds, providing potential for additional distribution.",4,COMP PR/RE,Ref006,"No means of eradication in marine environment. Fouling control options include chemical, mechanical, physical."
737,3,RE,"Ref012, Ref308","Has become one of the most common bivalves on the shore of Southend on Sea, Essex (England). May provide ecosystem services by taking some of the parasite load normally linked to native species.
In dense beds of razor clams, however, fine sediment particles accumulated which may have altered abundances of polychaetes.",4,RE,Locally patchy,Ref012,,3,RE,No,"Ref012, Ref228","It was supposedly introduced to Europe as larvae in tanker ballast water; its spread within European waters has been by pelagic larvae (Cosel, Dörjes & Mühlenhardt-Siegel 1982).
On average, the population spread by 125 km per year to the north and, at the same time, by 75 km per year to the west, against the residual currents.",4,RE,Ref012,No known effective controls in marine environment.
738,3,COMP PR/RE,"Ref309, Ref310, Ref311","Dense populations of plants reduce the water temperature and oxygen concentrations. This species was introduced to Australia and has become the most obstructive and persistent of all aquatic plants infesting irrigation supplies and drainage channels. Plants also have become widespread and troublesome in New Zealand.
It can form dense mono-specific stands. It does not reproduce by seed in the UK and relies entirely on vegetative reproduction for its spread. Although it is now regarded as a naturalised aquatic plant, it causes problems by competing for nutrients and outgrowing many native species. However, it is nowconsidered preferable to both major and nuttallii and where there is a danger of invasion from these species aftercontrol, care should be exercised not to eradicate all of the plant.
An important food for ducks.
Costly invasive in New Zealand due to interference with use of boat ramps.
Spread rapidly in the irrigation systems of south-eastern Australia. This threatened the efficiency of irrigated agriculture by impeding the flow of water in suppy and drainage channels (Aston 1973; Bowmer et al. 1979).
Expansion in Lake Baikal considered a catastrophic phenomenon; it's effect now covers practically the whole perimeter of Lake Baikal.",4,COMP PR/RE,Regionally patchy,Ref310,,3,COMP PR/RE,No,Ref311,"Probably introduced to Baikal by aquarists or by transport vehicles and transport together with fishes taken from lakes of the Urals. Spread may be due to navigation, but natural factors also affect its spread.",3,COMP PR/RE,Ref310,"Plants perennate by means of overwintering buds that sink to the bottom of the pond in the autumn and then commence growing in the spring. Mechanical, chemical, physical controls used to keep in check. Grass carp used for bio-control."
741,4,COMP PR/RE,"Ref012, Ref312, Ref313","It can reach high numbers and produce copious mucilage which 'in sinking' can accumulate insoluble skeletons of planktonic organisms and mineral particles, increasing its volume and density (Boalch & Harbour 1977) and blanket the seabed.
Fishing trawls may become clogged or broken by heavy grey slime. It may interfere with the hauling of fishing gear and prolonged washing or air drying may not completely remove it (Boalch & Harbour 1977).
Since 1980, the centric diatom C. wailesii Gran et Angst has been recorded worldwide, developing blooms and damaging shellfish and macroalgae cultivations, and commercial fishery areas (Nagai et al. 1995a; Nehring 1998).
Its blooms take up the nitrogen (sometimes added as fertilizer) needed for Nori growth (edible seaweed); this reduces yields and can also cause hypoxia leading to faunal mortality (Manabe and Ishio, 1991). Blooms of other Coscinodiscus species commonly occur in the North Sea, where their oily secretions have caused bird mortality (Tåning, 1951). In the German Wadden Sea, large-scale anoxia and benthic faunal mortality have accompanied Coscinodiscus concinnus blooms (Delafontaine and Flemming,1997).",4,COMP PR/RE,Regionally pervasive,Ref312,"Its distribution, first restricted to the tropical Pacific and west Atlantic oceans, has extended to Europe, the USA and Japan in recent years (Lange et al. 1992; Rick and Durselen 1995; Nehring 1998).",4,COMP PR/RE,No,Ref012,"Unknown, possibly ballast water or importation with oysters has been hypothesised as another potential vector (Rincé & Paulmier 1986; Wallentinus in press).
It spread rapidly and was recorded from the English Channel (near Plymouth, Devon) in 1977; Atlantic coast of France by 1978 and Norway by 1979 (Hasle 1990; Wallentinus in press).",4,COMP PR/RE,Ref012,No known controls.
742,2,COMP PR/RE,"Ref012, Ref314","When growing attached to oysters it floats away with the oyster when the air-filled thalli grow large enough, hence its name of oyster thief (Farnham 1980). Has negligible effects on the environment. 
Epiphytic on other algae.",4,COMP PR/RE,Regionally patchy,Ref641,In Europe it is found from Iberia to southern Norway. It has a world-wide distribution in temperate waters (South & Tittley 1986).,2,COMP PR/RE,No,"Ref012, Ref314","There was natural migration from France to Britain, and it may also have been introduced unintentionally with commercial oysters from France.  
Spreads marginally by natural means of dispersion. Temperature and other conditions for reproduction affect its spread.
It may be assumed to have spread to Sweden by drifting with currents, or on oyster shells or in some other way associated withaquaculture.",4,COMP PR/RE,"Ref012, Ref314",No known controls in aquatic environment. Lacks predators and has rapid growth rate.
744,3,COMP PR/RE,"Ref282, Ref283","Competes with native species for resources. 
Chara beds act as nutrient sinks in shallow lakes.",4,COMP PR/RE,Locally patchy,Ref282,,3,COMP PR/RE,No,Ref282,"Introduced to Baltic Sea by ballast sand.
While decreasing in some areas, the occurrence of C. connivens in increasing in Estonian coastal waters (Martin, G. Estonian Marine Inst).
Lower grazing pressure on Ch. connivens compared to other charophyte species may provide certain advantages in the competition and could be used to explain recent increase in distribution.",4,COMP PR/RE,Ref282,No known controls.
746,4,COMP PR/RE,Ref025,"Sediment ingestion has recently been identified as an important exposure route for toxicants in waterfowl. Compete with native waterfoul species (Gollach, Leppäkoski 1999). Can overgraze lawns & crops, leading to erosion. On lawns, their feces can annoy humans (Dewey, Lutz 2002). Trample vegetation & compact the soil, creating a ""hard pan"" that prevents new growth of vegetation. As a result, this denuded landscape provides little viable habitat for other wildlife species (French 2001). Can inflict serious physical and economic damage to agricultural crops, residential lawns, golf courses, and ornamental plants and gardens, particularly in areas where these birds have sought shelter during the molting period. In residential areas, feeding damage to grass, clover, and cover crops can leave large bare spots that will be subject to erosion (French 2001). Hybridize with representatives of Anatidae family.
Cryptosporidium sp. oocysts were found in feces at seven of nine sites, and Giardia cysts were found at all nine sites. The oocysts from three sites were infectious for mice and molecularly identified as the zoonotic genotype of Cryptosporidium parvum. Waterfowl can disseminate infectious C. parvum oocysts in the environment (Graczyk et al. 1998).
Economic benefits from hunting related expenditures. Can cause some economic threats to recreational business by fouling areas with droppings, or aggression toward humans. Droppings can foul water bodies, golf courses, reservoirs, or swimming pools.
A serious danger to aircraft. Aircraft have lost engines due to bird strikes.",4,COMP PR/RE,Locally pervasive,Ref025,,3,COMP PR/RE,No,Ref025,Potential for spread through natural migration.,3,COMP PR/RE,Ref025,Numbers have been reduced using birth control in food sources.
747,2,COMP PR/RE,Ref012,"Lack of grazers, rapid growth rate, and its opportunistic qualities have contributed to its success. Carpets rocks, competing with native species.",4,COMP PR/RE,Locally pervasive,Ref012,,3,COMP PR/RE,No,"Ref012, Ref314",,4,COMP PR/RE,Ref012,No known controls in aquatic environment.
748,2,COMP PR/RE,Ref268,"Predatory species that consumes animal food including fish. Adults feed on gobies and kilka/ sprat.
One of the three most important species for caviar.",4,COMP PR/RE,Locally pervasive,Ref268,,2,COMP PR/RE,No,Ref268,Potential for migration through water courses from Caspian Sea.,4,COMP PR/RE,Ref268,No known controls in aquatic environment.
751,2,COMP PR/RE,Ref006,"A. scaber may have a great impact in oyster and scallop beds due to predation, however there have been no recorded impacts of this species in its introduced range.",4,COMP PR/RE,Locally patchy,Ref006,Native to New Zealand.,1,COMP PR/RE,No,Ref006,"Human assisted transport. Potential for accidental translocations in oyster shipments, or as discarded bait.",U,COMP PR/RE,Ref006,
752,3,RE,"Ref006, Ref315","P. regularis is a carnivorous seastar which usually feeds on dead or dying animals. Utilises both microscopic and macroscopic food sources, feeding on a variety of organisms.
In New Zealand, P. regularis is consumed by fish found on rocky reefs. There have been no recorded predators of P. regularis in Australian waters. 
Competition for space and food, in some cases resulting in competitive exclusion of native species and changes in habitat structure e.g. Seastar (Patiriella regularis). May have excluded native seastars from the Derwent River Estuary in Tasmania.
There are no recorded impacts of P. regularis in Australian waters. It is possible that it competes with the native species of Patiriella such as the threatened P. vivipara for food and other resources.",4,RE,Locally pervasive,Ref006,,1,RE,No,Ref006,Human assisted translocations. Potential for future accidental introductions in translocations of fish or shellfish.,4,RE,Ref315,"No known controls. Prevention is best option. ""Treatment with non-specific chemicals is not an option in the open marine environment."""
754,3,COMP PR/RE,Ref037,Competes with native species for resources.,4,COMP PR/RE,Locally patchy,Ref037,,U,COMP PR/RE,No,Ref320,Range expansion through Suez Canal.,U,COMP PR/RE,,
756,2,COMP PR/RE,Ref037,Attach to corals and rocks. Compete with native species for resources.,4,COMP PR/RE,Locally patchy,Ref037,,U,,No,,,U,,,
36,4,COMP PR/RE,"Ref006, Ref073","Negatively modifies native habitat; fouling; economic losses to aquaculture. Competes for food and resources with native and aquaculture species. 
Known to consume planktonic larvae of other organisms and reducing their rates of settlement. In this way it can become a major problem for shellfish aquaculture, and it can also be a nuisance fouler of boat hulls and fishing gear.
In Japan, Styela clava has been blamed for an asthmatic condition in oyster shuckers, apparently caused by hammering open Styela-fouled oysters in poorly-ventilated work areas.
No recorded predators on Styela clava.",4,COMP PR/RE,Locally pervasive,Ref006,,1,COMP PR/RE,No,Ref002,A fouling organism requiring assisted transport to expand alien range.,4,COMP PR/RE,"Ref006, Ref073","Many management options listed for control, but are costly and time consuming."
37,3,COMP PR/RE,"Ref002, Ref012, Ref090","Reduces biodiversity by overgrowing in native habitats; economic losses in aquaculture.  Wakame is economically important as a food crop but is also a fouling organism. It is able to compete with native kelp species in the shallow sublittoral/infralittoral zone (Farrell & Fletcher, 2000). It is also effective in providing habitats, nursery areas and protective cover for many species. It grows well in estuarine conditions unlike many of the native kelp species (Farrell & Fletcher, 2000) .",4,COMP PR/RE,Regionally patchy,Ref006,,3,COMP PR/RE,No,"Ref002, Ref012","Natural dispersal occurs following the release of motile spores from the sporophyte. The distance over which spores travel before settling will largely be determined by their viability and behaviour and the speed of ambient water currents, it can extend from hundreds of meters to several kilometers.
It produces millions of spores with motile periods of up to 5 hours and has a propensity for colonising floating objects (Fletcher & Manfredi 1995) which suggests it can easily be spread locally by natural dispersion and more remotely through the agency of shipping.",4,COMP PR/RE,Ref006,"Prevention most effective, eradication unlikely to succeed. Natural dispersal allows reintroductions."
38,3,COMP PR/RE,"Ref006, Ref238","Fouling; intense competition that leads to complete habitat domination. If they became established in NSW (Australia) waters, these mussels could devastate the shellfish, fishing, tourism and other marine industries.",4,COMP PR/RE,Regionally patchy,Ref006,,1,RE,No,Ref030,A fouling organism requiring assisted transport to expand alien range.,2,COMP PR/RE,"Ref006, Ref238",Chloride or copper sulphate effectively eradicates new infestations.
107,3,RE,Ref007,Crowds out other species in shallow water and neighboring damp soil,2,RE,Locally pervasive,Ref007,Pervasive in a small patch along Australia's eastern coast,4,RE,No,"Ref007, Ref205","Grows prolifically, spreads rapidly. Has potential to expand to the northern coast - seeds or branches take root when they contact soil or water. Seeds dispersed by wind, water, human activity, birds and other small animals.",3,RE,Ref007,"Mechanical, physical, cultural controls used."
147,3,COMP PR/RE,"Ref009, Ref002","Competes with native reef algae species by forming dense mats and inhibiting growth; reproduces quickly in Hawai'i.
Gracilaria salicornia threatens reef corals and native benthic communities in Hawaii and elsewhere. It reduces marine species diversity and alters marine community structure.",4,COMP PR/RE,Locally pervasive,Ref009,,4,COMP PR/RE,No,"Ref207, Ref002","It has spread over 5 kilometers from its point of introduction on O‘ahu since it was introduced in 1978. 
Fragmentation or vegetative propagation is a common mode of reproduction and may be an important mechanism for algal propagation (Smith and Walters 1999, in Smith Hunter and Smith 2002). Any sort of physical disturbance can generate fragments including wave action, fish grazing and human disturbance, and once these propagules are generated they most likely disperse through currents and other hydrodynamic events such as large swells (Smith In Press). For G. salicornia the smallest (0.5 cm) fragments grow the most showing that pieces of tissue as small as 0.5 cm are viable as propagules (Smith Hunter and Smith 2002).",3,RE,Ref002,"Manual removal to control, but fragments regenerate. Multidisciplinary approach required."
148,3,COMP PR/RE,Ref009,Forms large monospecific mats; easily outcompetes native algae by reproducing rapidly; causes foul odors when large mats wash ashore,4,COMP PR/RE,Locally pervasive,Ref009,,4,RE,No,Ref207,"Has rapid growth rate, ability to epiphytize other algae and fragments easily. Drifting fragments reattach to other algae, especially Sargassum, which can become detached during storms and float long distances, carrying the epiphytic H. musciformis with it.
Introduced for mariculture to Kane'ohe Bay in 1974 and spread to other islands by 1982.",3,RE,Ref002,A recovery rate of 87% each month after harvest. Scientists must overcome this extremely rapis recovery rate.
149,3,COMP PR/RE,Ref009,"This species has an extremely high growth rate; although it has been found to provide habitat for many marine species, it can smother coral reefs.  It is used by humans as a homogenizer in many products",4,COMP PR/RE,Locally pervasive,Ref009,,3,,,"Ref207, Ref002","Since their introduction in Kaneohe Bay in 1974, they have spread at the rate of 260 m/yr. Kappaphycus spp. alga may be able to spread laterally but, does not appear to be able to spread long distances or between islands"" (Smith et al. 2002).
Dispersal is thought to be constrained by size and weight, as it appears to become trapped in depressions and channels.",3,RE,Ref002,Can regrow from fragments as small as 0.5 cm making it an extremely difficult species to control.
