Species.ID,Ecol.Imp.Score,Ecol.Imp.Docu,Ecol.Imp.Sources,Ecol.Imp.Text,Scope.Score,Scope.Docu,Scope.Distribution,Scope.Sources,Scope.Text,Inv.Potl.Score,Inv.Potl.Docu,Inv.Potl.Established,Inv.Potl.Sources,Inv.Potl.Text,Mgt.Diff.Score,Mgt.Diff.Docu,Mgt.Diff.Sources,Mgt.Diff.Text
498,4,COMP PR/RE,Ref019,"A non-native portunid crab (swimming crab), Charybdis hellerii could potentially compete with native brachyuran crabs, particularly with other portunids such as Callinectes spp. for food and habitat in the Indian River Lagoon.  If this is the case, the fishery for Callinectes sapidus could be negatively impacted (http://www.sms.si.edu/irlspec/Charyb_heller.htm).",4,COMP PR/RE,Regionally patchy,Ref019,"Native of Indo-Pacific now spread through Mediterranean, to North America, South America, Caribbean & Hawaii.",2,COMP PR/RE,No,Ref019,"Possible that this species was introduced in one or more sites and subsequently dispersed via larval stages to various other coastal environments in the (USA Gulf coast) region (Gomez and Martinez-Iglesias, 1990).
Most likely human assisted transport of larvae in ballast water.",3,COMP PR/RE,Ref019,"Quarantine ships ballast water, monitor live animal trade, detailed inspections. Even with controls in place the species has still managed to invade new territory."
501,4,COMP PR/RE,Ref019,"Salaya (1973) also noted that the brown mussel competed with unidentified species of Balanus and Tetraclita for substrate settlement.
The brown mussl can sink navigation buoys and affect shipping safety (Hicks and Tunnel, 1995).",4,COMP PR/RE,Locally pervasive,"Ref019, Ref005","Found colonizing offshore oil rigs in the Gulf of Mexico up to 9m below the surface (Hicks and Tunnell, 1995).",3,COMP PR/RE,No,"Ref019, Ref002","The mussels are expected to move farther east to the Yucatan penninsula and farther north in along the Gulf of Mexico coast (Hicks and Tunnel, 1995). The expansion and effects of distribution of this bivalve is currently being monitored in Texas (McGrath, 1997; Hicks and Tunnell, 1999). 
The mussel was probably dispersed southward by long range and inshore currents (Gulf States Marine Fisheries Commission, 2003).
.",4,COMP PR/RE,Ref019,Reproductive strategies and long range dispersal make eradication likely impossible. Ballast water treatment necessary.
515,4,COMP PR/RE,"Ref019, Ref024","Could change structure of fresh/brackish water benthic invertebrate communities. Potential predation on salmonid/sturgeon eggs/juveniles. Burrowing crabs could accelerate erosion of banks & reduce leeve stability. Damage commercial fishing nets, eat rice crops in China. Have clogged pumps, screens, intakes & damaged & killed fish at salvage facilities associated with water diversions.
Intermediate host of lung fluke in Far East",4,COMP PR/RE,Regionally pervasive,Ref024,"It has now spread throughout Europe to California, USA.",4,COMP PR/RE,No,"Ref024, Ref002","Utilizes the dispersion of planktonic larvae to colonize new areas.
Spread quickly because they are able to walk over land to invade neighboring river systems.",4,COMP PR/RE,"Ref024, Ref002",Physical controls unsuccessful. Species dispersal limits chemical controls. Bio-controls (fungi) hold promise. Prevention legislation necessary.
518,1,COMP PR/RE,Ref019,"May potentially compete for nesting areas/crowd out native species due to ability to thrive in intervened areas. Little impact on any particular native species & diets do not overlap w/natives. According to Weber (1972) the cattle egret ""should be classified as a graceful and beneficial addition to the American avifauna"".
They have been observed feeding on native species of birds and it hosts ticks that could introduce and spread certain tick borne diseases.
Some ranchers rely on cattle egrets for fly control more than they do pesticides (Ivory, 2000).",4,COMP PR/RE,Regionally pervasive,Ref019,"North, Central, South America established colonies.",2,COMP PR/RE,No,Ref019,"Have established breeding populations within 10-20 yrs. Apparent lack of native competition in established areas. 
Have strong migratory instincts and disperse thousands of miles in the direction of their choosing. They are, for the most part, self-introduced.",4,COMP PR/RE,Ref019,Most likely irreversible
522,3,COMP PR/RE,Ref019,Problem on ships hulls causing drag & transporting to new environments. Clog desalination plant inflow pipes. Found in Miami growing on spines and skin of sea urchins.,4,COMP PR/RE,Regionally pervasive,Ref019,A global invasive problem,1,COMP PR/RE,No,Ref019,A fouling organism requiring assisted transport to expand alien range. Some potential to expand introduced range by larval dispersal in water currents.,U,COMP PR/RE,Ref019,
523,1,COMP PR/RE,Ref019,"Of commercial interest for food. Vietnam harvests similar species. Omniverous, feeding on plant material, carrion, & small prey.",4,COMP PR/RE,Regionally pervasive,Ref019,Invaded North America from South American regions.,3,COMP PR/RE,Yes,Ref019,"Adults invade bays, which may account for its widespread distribution. Able to spread through river systems from bay to bay or by dispersal of their larvae which may be more tolerant of higher salinities than the adults (Gunter, 1937). Potential invader of Greater Tampa Bay ecosystem.
Original introduction accidental with aquatic plants and fish from South America.
The planktonic zoea of the bristled river shrimp migrate from freshwaters in which they hatch, to saltwaters in order to grow and develop.",U,COMP PR/RE,Ref019,Not enough information on management.
524,1,COMP PR/RE,Ref019,"P. monodon is a known carrier of Monodon baculovirus (MBV), yellow-head virus (YHV), Infectious hypodermal and hematopoietic necrosis virus (IHHNV), hepatopancreatic parvo-like virus (HPV), baculoviral midgut gland necrosis virus (BMNV), P. monodon - type baculovirus (MBV), lymphoidal parvo-like virus (LPV), and Reo-like virus (RLV) (Lightner et al., 1983, 1985; Lightner, 1993, 1996). This viruses can be transmitted to native wild penaeid shrimp populations, and thus increases the concern if the disease is introduced by releases from culture facilities (Overstreet et al., 1997; JSA, 1997).",4,COMP PR/RE,Locally patchy,Ref019,"Native to Asia, small populations occur throughout Gulf Coast states and Hawaii.",1,COMP PR/RE,Yes,Ref019,,U,COMP PR/RE,Ref019,No information on management.
525,3,COMP PR/RE,Ref019,"Exotic shrimp viruses may pose a risk to Gulf of Mexico and Southeastern U.S. Atlantic fisheries, including economically-important penaeid shrimp as well as other crustaceans (J.S.A., 1997).",4,COMP PR/RE,Regionally pervasive,Ref019,Native to Mexico has established from Peru to southeastern USA,1,COMP PR/RE,No,Ref019,,U,,,No information available.
528,4,COMP PR/RE,Ref019,"Courtenay et al. (1974) reported depletion of aquatic vegetation in areas where blackchin tilapia were common caused by overgrazing. These authors also noted that in Lithia Springs, Florida, where blackchin tilapia constituted 90% of the total fish biomass, co-occurring largemouth bass and bluegill appeared diseased and malnourished. given their adaptability to broad salinity ranges and their trophic plasticity, they can become locally dominant and contribute to lowering biodiversity (Springer and Finucane, 1963; Courtenay et al. 1974; Dial and Wainright, 1983). As is the case with other cichlids, blackchin tilapia also compete with native fishes for breeding grounds.",2,COMP PR/RE,Regionally pervasive,Ref019,"Records of invasion in Florida. Introduced to Oahu, Hawaii.",4,COMP PR/RE,No,"Ref019, Ref005","North temperature appears to be a limiting factor, there are few if any factors limiting their spread throughout most of south-central Florida.
Introductions mostly human assisted: aquarium releases, aquaculture escapes, sport introductions.
Reported to be spreading rapidly around Oahu, Hawaii",U,COMP PR/RE,Ref019,No information on attempts to manage established populations.
529,3,COMP PR/RE,Ref019,"Out-competes and displaces native species, greatly increases total biomass in regional lakes. Aggressive behavior probably alters community structure where they are abundant (McBay, 1961).",4,COMP PR/RE,Regionally pervasive,Ref019,Spread throughout Gulf States from Florida to Texas.,4,COMP PR/RE,No,Ref019,"Human assisted introductions: stocking for aquaculture, bio-controls, bait bucket releases. Intentional and accidental fish farm releases.
Wide spread in Florida & Texas, & continue to expand their range (Courtney et al. 1991).",4,COMP PR/RE,Ref019,"Was successfully eradicated from Trinidad Reservoir in Texas, but so widespread now that eradication from riparian habitats impossible."
540,3,COMP PR/RE,Ref019,"Reported to pioneer waters poor in resources, and become an important forage fish for larger animals to feed on (Shafland, 1996). Some concern regarding its predation on native juvenile sport fishes, such as snook and tarpon, in estuarine areas (Shafland, 1996). will probably alter community structure through aggressive interactions and/or direct competition with native fishes & compete for breeding grounds.",4,COMP PR/RE,Locally pervasive,Ref019,"Native of Central America, now established in Joe Bay in NE Florida Bay & Anhinga Trail ponds in the Everglades, Florida",1,COMP PR/RE,No,Ref019,"Stauffer and Boltz (1994), reported a lower lethal temperature of 15°C for this species, which limits its potential range expansion northward in Florida. One of the most common fishes caught on hook and line in certain parts of the Everglades.",U,COMP PR/RE,,
542,4,COMP PR/RE,Ref002,Impacts native species through direct predation & transmission of diseases.  Suspected threat in Hawaii to native species such as striped mullet Mugil cephalus. Considered major factor in decline of  desert pupfish Cyprinodon macularius in Salton Sea area.,4,COMP PR/RE,Regionally pervasive,Ref019,,4,COMP PR/RE,No,"Ref002, Ref019","Established populations of this species in the wild are a result of intentional releases (aquatic plant control) or escapes from fish farms. The mouthbrooding habit of this species allow it to nurture and carry its young long distances to invade habitat far from the original site of introduction (Costa-Pierce, 2003).
Burrows in the mud in drought or cold & remains for extended periods, until environmental conditions improve. Broad tolerance for physiological parameters, low vulnerability to predation, a flexible diet, & high reproductive potential.",4,COMP PR/RE,Ref002,"Eradication has been suggested on Tarawa and Nauru (Eldredge, 2000). No known safe and effective eradication techniques developed."
545,4,COMP PR/RE,"Ref019, Ref005","A voracious predator known to reduce populations of eastern mosquitofish Gambusia holbrooki & other native poeciliid and cyprinodontid populations in areas where it has been introduced.
Their predation on mosquitofish as well as on other cyprinodontiform fish, impairs natural mosquito control in southern Florida (Lee et al., 1980). 
Additionally they have been reported as highly detrimental to various marsh communities in Florida, naturally impoverished in ichthyophagous species (Shafland, 1996).",4,COMP PR/RE,Regionally pervasive,Ref019,,3,COMP PR/RE,No,Ref019,"The euryhaline nature of pike killifish has facilitated their spread throughout Florida. They can readily tolerate habitats deficient in oxygen (Lee et al., 1980; Page and Burr, 1991). Pike killifish continue expanding their range in this state (Shafland, 1996).",4,COMP PR/RE,Ref019,"Some populations die out on own, but still unable to eradicate from Florida. Continued introductions from aquarists inhibits eradication attempts."
548,4,COMP PR/RE,"Ref019, Ref005","Considered a potential competitor with native fish for food and spawning areas, and is potentially detrimental to California rice crops (Pelzman 1973).
A oracious herbivore which constitutes a serious threat to native aquatic plants, and the organisms that depend on these. Walter Courtenay in Hogg (1976) called it ""the most destructive fish to submerged vegetation known next to the grass carp"". 
Given their breeding habits, redbelly tilapia could compete with centrarchids for nesting sites and alter the stability of fish communities, through aggressive interactions.
In Hyco Reservoir, North Carolina, feeding by introduced redbelly tilapia eliminated all aquatic macrophytes from the reservoir within a 2-year period that coincided with declines in populations of several native fishes; tilapia populations continued expanding in the absence of macrophytes because of its ability to switch to alternate food sources (Crutchfield et al. 1992; Crutchfield 1995).",4,COMP PR/RE,Locally patchy,"Ref019, Ref005","Native of Africa, now found throughout United States w/established populations in western and southern states and three Hawaiian Islands.",1,COMP PR/RE,No,"Ref019, Ref005","Introduced in most locations by state agencies, universities, or private companies for control of aquatic plants, to control mosquitoes and chironomid midges, as forage or food fish, and for aquaculture evaluation.",2,COMP PR/RE,Ref005,"Considered eradicated from all sites in Florida (Smith-Vaniz, personal communication) and Nevada (Courtenay et al. 1984, 1986)."
560,3,COMP PR/RE,Ref019,"Anguillicola crassus considered a major threat to European eel fisheries (Hoglund and Thomas, 1992). In U.S., measures to stem the spread of parasite will affect aquaculturists. Growers, importers and exporters face the potential for monetary loss from quarantine and crop destruction (Fries et al., 1996).",4,COMP PR/RE,Regionally pervasive,"Ref019, Ref012",Apread through Europe and parts of USA,2,COMP PR/RE,No,"Ref019, Ref012","It is thought that A. crassus was introduced to western Europe by infected Asian eels imported for consumption and aquacultural restocking (Peters & Hartmann, 1986; Belpaire et al., 1989a).  A factor contributing to the rapid spread of A. crassus is that it is not particular about habitat or transfer hosts (Taraschewski et al., 1987). Capable of surviving in eels in freshwater, brackish water, and seawater (Kennedy and Fitch, 1990). Introduction of even a few individuals of the parasite to new geographic through careless import, export and restocking practices can result in exponential spread of the parasite (De Charleroy et al, 1990).",4,COMP PR/RE,Ref019,Chemical control measures have failed. Best approach is through legislation regulating import and export of eels.
569,3,COMP PR/RE,Ref054,"Densities of zooplankton were low when medusa densities were high, and estimated predation by M. lyonsi could have limited copepod populations in the mesocosms.",4,COMP PR/RE,Locally patchy,Ref005,,2,COMP PR/RE,No,"Ref054, Ref005, Ref269","A fouling organism transported through shipping traffic. The colonizing potential of this hydrozoan is great given the high rates of asexual reproduction, fairly wide salinity tolerance, and resistant cyst stage. 
Entire populations may be generated from a single introduced male polyp. No known predators. Have potential to invade all low-salinity San Francisco Estuary environments.
Transported in ballast water.",U,,,
579,3,COMP PR/RE,Ref019,"Disease risk posed by MBV to native shrimp stocks of the Gulf of Mexico is unkown. Gross signs of PmSNPV include decreased feeding & growth rates, & increase gill & surface fouling by epibionts. In severe cases larvae & postlarvae may have white midguts (Lightner, 1996). Since this viral species infects a commercially important shrimp, attention to it is warranted.
Susceptible species include: Penaeus monodon, Fenneropenaeus merguiensis, Melicertus plegejus, Metapenaeus ensis, P. esculentus, P. semisulcatus, F. penicillatus, and Melicertus kerathurus",4,COMP PR/RE,Locally pervasive,Ref019,,2,COMP PR/RE,No,Ref019,Found in wild and cultured populations of shrimp in South Carolina and Texas.,3,COMP PR/RE,Ref019,"Implement strict biosecurity measures including histological exam of all incoming stock. The severity of infections seems to decrease after PL-25. With good management proceedures, shrimp infected with MBV (even with severe infections) can survive."
584,3,COMP PR/RE,Ref019,"Known to cause disease in P. japonicus and P. penicillatus and to experimentally infect larval Litopenaeus stylirosturs and L. penaeus (Tapay et al., 1996). The disease resulting from WSBV infection is highly lethal with cumulative mortality reaching 100% within 2 to 7 days post infection.",4,COMP PR/RE,Locally pervasive,Ref019,"Because the shrimp industry relies on intraregional transport of stocks, the distribution of these viruses may be larger than indicated and may be expanding (Lightner, 1996).",2,COMP PR/RE,No,Ref019,"Since its appearance in 1992-1993 in northeast Asia, the Strains of WSBV have spread rapidly throughout most of the shrimp growing regions of Asia and Indo-Pacific (Lightner, 1996).",3,COMP PR/RE,Ref019,"Testing import shrimp, screening broodstock and postlarvae using DNA probe, washing nauplii after harvesting. Formalin has proved effective without detriment to shrimp stock. All effluent should be treated with formalin before discharge."
602,3,PR,Ref005,Competes with natives for resources.,4,PR,Locally pervasive,Ref005,,1,PR,No,"Ref005, Ref093",Known to be an aggressive invader. Potential for transport in ships fouling communities or ballast water.,U,,,
604,3,COMP PR/RE,Ref005,"Contributed to defoliation of kelp bed at Cape Neddick, Maine. Outcompetes other encrusting growth such as Electra pilosa (another bryozoan) and Obelia geniculata (a hydroid). Kelps encrusted with M. membranacea are more susceptible to fracturing during storms. Heavy encrustaceans can also affect the abundance and composition of organisms in affected kelp communities. In New England Sea urchin Strongylocentrotus droebachiensis abundance dropped from an average of between 20 and 280 per square meter before the invasion to 0.47 per square meter after the invasion.",4,COMP PR/RE,Locally pervasive,Ref005,,4,COMP PR/RE,No,"Ref005, Ref066",Introduced to area via shipping on hulls or in ballast water. Membranipora became the dominant kelp epiphyte off the coast of New Hampshire and southern Maine in three years (Berman et al. 1992). Has higher settlement and faster growth rates than native species with no known predators.,4,COMP PR/RE,Ref066,No known effective controls in introduced range.
606,2,COMP PR/RE,Ref314,"G. vertens reportedly has an even more potent sting in its original environment in the Seas of Okhotsk and Japan. Sensitive humans who come into contact with its stinging cells in that region may suffer severe allergic reactions, resulting in the worst cases in fatal anaphylactic shock.",4,COMP PR/RE,Locally patchy,Ref005,,2,COMP PR/RE,Yes,Ref012,"Human assisted transport: hull fouling in polyp stage, or accidental with importation of Japanese oysters. It can also disperse in the hydromedusae stage in water currents and ballast water.",U,,,
607,2,COMP PR/RE,"Ref005, Ref068","The medusae eat larvae of an introduced mud crab, Rhithropanopeus harrisi (Mills and Sommer 1995).
Dense populations of this jelly can alter estuarine food webs. The prey of this jelly includes small adult crustaceans and larvae, so local populations of crabs and their relatives could be diminished.",4,COMP PR/RE,Locally patchy,Ref005,,2,COMP PR/RE,No,"Ref005, Ref270",Know to be transported and discharged from ballast water. Tolerant of brackish and low salinity environments. Spread from original ports of entry into estuaries and river systems.,U,,,
608,3,COMP PR/RE,"Ref005, Ref063","Preys on A. aurita & availability of moonjellyfish  may have facilitated the 2000 outbreak.
It feeds on other gelatinous zooplankton, including native jellyfish & capable of episodic population explosions (Larson, 1987; Graham and Young, 2002). Large jellyfish can clog fishing gear, the stings can deter swimmers, and in sufficient numbers, this species may be able to alter plankton dynamics by feeding on native zooplanktivorous jellyfish.",4,COMP PR/RE,Locally patchy,Ref005,Multi ecoregional.,2,COMP PR/RE,No,Ref005,"Human assisted transport through shipping or seagoing infrastructures (towed oil or gas platforms) as vectors. However, transport may be due to natural ocean currents. One theory attributes summer of 2000 invasion in northern Gulf of Mexico to Loop Current and its spin-off eddies.",4,COMP PR/RE,Ref005,Repeated outbreaks/sightings due to natural ocean currents.
611,3,COMP PR/RE,Ref005,Established and common. These worms are often so abundant that they bury the oysters in several inches of mud tubes.,4,COMP PR/RE,Locally pervasive,Ref005,"One account states it has been reported from ""just about everywhere in the world.""",1,COMP PR/RE,No,Ref005,,U,,,
613,3,COMP PR/RE,Ref005,Created bifouling problem at Jacksonville Electric Authority's Northside Generating Station by clogging an intake pipe filter just feet away from steam condensers. Mussels collected in Mosquito Lagoon were collected off a reef where they could compete with native organisms for food and habitat.,4,COMP PR/RE,Locally patchy,Ref005,Native of South America collected in Florida.,1,COMP PR/RE,No,Ref005,Potential for spread through ballast water exchange or hull fouling. May spread on water currents attached to driftwood.,2,COMP PR/RE,Ref005,Early detection and removal is key to prohibiting introduction.
614,1,COMP PR/RE,"Ref005, Ref061","Females mature at 50 mm; spawn in summer, can produce over one million eggs, larvae settle within 30 days, suspension feeders, densities can reach 300 per square yard.
May be competitive interactions between the European oyster and native species that have yet to be observed.",4,COMP PR/RE,Locally pervasive,Ref005,Native to eastern Atlantic. Have established on coast of western Atlantic.,1,COMP PR/RE,No,Ref005,,U,,,
616,3,COMP PR/RE,"Ref005, Ref065","Can destroy or cause collapse of untreated wood structures. Filter feeders that may compete with native species for resources. Larvae settle and construct extensive burrow systems on any wooden structures (boat hulls, marinas, docks and pilings). Caused $615 million in damage in San Francisco Bay in 1920's. Similar damage reported from Barnegat Bay, NJ and Long Island Sound, NY.",4,COMP PR/RE,Locally patchy,"Ref005, Ref065",,1,COMP PR/RE,No,"Ref005, Ref065, Ref271","The primary mechanism of the range extensions is by boat transport. Shipworms are generally tolerant of a wide range of salinities, temperatures, flow conditions, and oxygen concentrations. Dispersed by planktonic larvae. Outbreaks follow increased water temperatures and salinities in power station effluents.",2,COMP PR/RE,Ref065,Effective control can be accomplished by chemical treatment (e.g. creosote) of wood or use of alternative materials.
619,4,COMP PR/RE,"Ref005, Ref002","A predominant mollusk from New Jersey northward, has had large negative impacts on invaded ecosystems; completes with native gastropods & other littorines. Can breed all year, primarily and algae grazer, but will feed on small invertebrates such as barnacle larvae. Has drastically altered New England intertidal community structure by allowing slow growing Chondrus crispus to overtake faster growing green algal species. In open coast and estuary habitats can be found at densities of 200-500 individuals per sq. meter.",4,COMP PR/RE,Locally pervasive,Ref005,"Native of Eurasia, now established in North America",2,COMP PR/RE,No,"Ref005, Ref002","Egg capsules are shed directly into the sea. Larval settling time or pelagic phase can be up to six weeks. 
Potential for localized spread in ocean currents. It has been suggested that L. littorea can serve as a highly suitable bio-indicator species for contamination of marine environments.
Potential for spread or new introductions through ballast or continued live food trade.",4,COMP PR/RE,Ref002,"For similar species, biocides, manual removal, and bio-control agents have been considered, however, little has been done in the way of eradication."
621,4,COMP PR/RE,"Ref005, Ref037, Ref002",Carniverous gastropods whose main diet consists of a variety of other mollusk species such as native oysters. A major pest of oyster beds. Have caused significant changes in the ecology of bottom-dwelling organisms.,4,COMP PR/RE,Locally pervasive,Ref005,Native of western Pacific now estabished in Black Sea & east coast of South America.,1,COMP PR/RE,No,"Ref005, Ref037, Ref002","This fertile species is extremely versatile, tolerating low salinities, water pollution and oxygen deficient waters.
Spreading less rapidly, but no less of a threat due to spread through planktonic larvae. Most likely spread in ballast water or via the transport of egg masses with marine farming products. R. venosa reproduces by laying clusters of egg capsules that resemble small mats of yellow shag carpet, which produce pelagic larvae that eventually settle on the bottom where they develop into hard-shelled snails.",4,COMP PR/RE,Ref002,"Recent studies in Adriatic Sea find ""breakwaters could represent prerential sites for maintenance of R. venosa"". Predation by blue crabs, mud crabs, & spider crabs could be natural control mechanism. Spread inevitable, eradication unlikely."
623,2,COMP PR/RE,"Ref005, Ref051","Known to rapidly devour hydroid colonies (especially Cordylophora lacustris, Laomedia spp & Protohydra leuckarti - (habitats.org.uk)",4,COMP PR/RE,Locally patchy,Ref005,Cross continental.,2,COMP PR/RE,No,Ref090,"It has been suggested that the developmental plasticity and rapid growth of this species enables it to disperse to new locations to find new food.
The wide geographic distribution of Tenellia adspersa is probably due to passive transportation of adults and egg masses by Cordylophora colonies on ships.",U,,,No information found.
