Species.ID,Ecol.Imp.Score,Ecol.Imp.Docu,Ecol.Imp.Sources,Ecol.Imp.Text,Scope.Score,Scope.Docu,Scope.Distribution,Scope.Sources,Scope.Text,Inv.Potl.Score,Inv.Potl.Docu,Inv.Potl.Established,Inv.Potl.Sources,Inv.Potl.Text,Mgt.Diff.Score,Mgt.Diff.Docu,Mgt.Diff.Sources,Mgt.Diff.Text
831,1,COMP PR/RE,Ref358,"Fouling organisms. Found in association with the macroalga Sargassum muticum and on artificial substrates such as mooring lines.
Prevalent in aquacultural facilities.",4,COMP PR/RE,Locally pervasive,Ref639,,2,COMP PR/RE,No,Ref639,"Well established in British coastal waters and is likely to continue spreading. Human activities in coastal waters such as shipping and the movement of small boats around the coast, and aquaculture activities are the factors most likely to influence the spread and distribution of Caprella mutica.
Potential for transport in ballast or fouling communities on transoceanic vessels and aquaculture. 70% of introductions associated with international ports. Also associated with drifting seaweed (Sano et al. 2003)",4,COMP PR/RE,Ref639,"No known controls in aquatic environments. Prevention includes cleaning ships hulls, serililzing ballast and fouling communities."
832,3,COMP PR/RE,"Ref642, Ref069","The animals are serious competition for native Carcinus maenas. An opportunistic omnivore, it feeds on algae, invertebrates, and larval and juvenile fishes throughout the rocky shore.",4,COMP PR/RE,Regionally patchy,Ref347,,4,COMP PR/RE,No,"Ref347, Ref069","Likely to extend its range to a large part of European coasts in sheltered habitats. It is not ruled out that it will cross the Atlantic to the American side with water ballast.
Can produce up to 50,000 eggs three to four times during the spawning season, compared to our region’s native crabs that reproduce twice each year. The larvae are free-floating for nearly a month before becoming juvenile crabs, increasing the possibility of being transported to new areas.",4,COMP PR/RE,Ref347,No known controls in aquatic environment. Prevention from spreading to North America is key.
833,3,COMP PR/RE,"Ref645, Ref265","Experiments have shown that an interspecific competition exists for space between (the European native) C. maenas and H. penicillatus. Relative high mortality of C. maenas observed in the presence of H. penicillatus suggests that the Asian decapod has the potential to dominate the native C. maenas.
Densities of infestations can be as high as 20 specimens/m2. H. penicillatus is undoubtedly having an effect on other rocky shore organisms through predation and other competitive interactions.",4,COMP PR/RE,Locally pervasive,Ref265,,4,COMP PR/RE,No,Ref265,,4,COMP PR/RE,Ref265,No effective means of eradication in aquatic environment.
834,3,COMP PR/RE,"Ref087, Ref638","Recently, an overpopulation of red king crabs in the Barents Sea is causing concern about the local biosystems. It was introduced artificially in the Murmansk Fjord in Russia during the 1960s to provide new catch for the Soviet fishermen.
The king crab predates on several groups of bottom animals and is questioned to have a significant impact on the benthic fauna, but this influence has yet been poorly documented.
To predict the impact of this non-native species, putative impacted and randomly selected control locations are followed using long-term monitoring. Experimental studies in the laboratory and the field is carried out in order to reveal the mechanisms by which this introduced species may alter and influence community structure.",4,COMP PR/RE,Regionally pervasive,Ref087,,1,COMP PR/RE,No,Ref087,"Since its introduction it has spread west along the Norwegian coast and also towards the island group of Svalbard [3][4]. Environmentalists and some local fishermen fear the crab because it eats everything it comes across and is spreading very rapidly (despite this threat, some fishing quotas on the crab are still in place).",4,COMP PR/RE,Ref087,"No known controls in aquatic environment. Increasing harvest may reduce numbers, but only seasonally."
850,1,PR,Ref438,Compete with native species for resources,4,PR,Locally patchy,Ref438,Atlantic distribution of this species,3,COMP PR/RE,Yes,"Ref438, Ref723",Potential to spread from introduced regions on floating seaweed.,4,COMP PR/RE,"Ref438, Ref723",No known controls - species continues to spread.
851,1,COMP PR/RE,Ref558,Competes with native species for resources,4,COMP PR/RE,Locally patchy,Ref558,,3,COMP PR/RE,No,"Ref558, Ref724","Potential for transfer via hull fouling, range expansion.",3,COMP PR/RE,"Ref558, Ref724",No known eradications in marine environment. Current populations are under control.
852,1,COMP PR/RE,Ref005,Competes with native species for resources.,4,COMP PR/RE,Locally patchy,Ref005,,3,COMP PR/RE,No,"Ref005, Ref725",Distributed via ballast water and ship fouling,3,COMP PR/RE,Ref725,No effective eradications known to date.
853,2,COMP PR/RE,Ref728,Competes with native species for resources.,4,COMP PR/RE,Locally patchy,Ref005,,1,COMP PR/RE,No,"Ref727, Ref728","Have been shown to take advantage of disturbance events such as storms, floods leading to population increases.",3,COMP PR/RE,Ref727,"No successful eradication methods, no need for management at this time."
858,2,PR,Ref631,"Potential risk to humans, since it contains tetrodotoxin (TTX) that may be a source for food poisoning. Two cases of poisoning of persons who had consumed this fish were reported from Israel and Lebanon (Golani et al 2006).",4,PR,,Ref631,,4,PR,,Ref631,"Spread rapidly along the Turkish Coast and into the Aegean, repeating the spread pattern previously observed for L. suezensis. 1st occurrence in 2003, now common along Levantine coast.",4,PR,Ref631,
882,3,COMP PR/RE,Ref024,"Smelt have actually damaged the large sport fish populations in two ways. First, the adult smelt actually prey on the young sport fish. This added source of predation has decreased the abundance of sport fish in many ecosystems. The other negative effect of Smelt is that that as young of year fish the smelt directly compete with the young sport fish for the limited supply of zooplankton.
Rainbow Smelt populations that are found in inland lakes can have negative effects on the lake community. The smelt concentrates PCBs in its fatty tissue, and magnifies it through the food chain. High mercury levels also accumulate in the top food chain predators.",4,COMP PR/RE,Locally pervasive,Ref024,,3,COMP PR/RE,No,Ref024,Have expanded range via connected waterways.,3,COMP PR/RE,Ref024,Commercial fishing can aid in keeping populations under control in introduced waters.
885,1,COMP PR/RE,Ref039,"A popular aquarium fish - high potential for release. High, minimum population doubling time less than 15 months.",4,COMP PR/RE,Locally patchy,Ref039,,1,COMP PR/RE,No,Ref039,Range expansion from introduced areas.,2,COMP PR/RE,Ref039,No effective eradication methods in marine environment.
892,1,COMP PR/RE,"Ref708, Ref707","Competes with native species for resources. Often found in highly polluted habitats, unsuitable for other species.",4,COMP PR/RE,Locally patchy,"Ref005, Ref708, Ref707",,1,COMP PR/RE,No,Ref707,"The evident resistance to various pollutants enables the settlement of P. bavaricus in such habitats, which are unsuitable for other oligochaete species.",U,,,
902,4,COMP PR/RE,"Ref355, Ref754","This species bores into wood, peat, soft sandstone and styrofoam floats.
Appears to be accelerating shoreline erosion in Coos Bay, Oregon (USA). In some heavily infested Californian marshes, erosion can exceed one meter per year (Talley et al. 2001). The wide distribution and high densities S. quoianum attains have clear environmental and economic implications.",4,COMP PR/RE,Locally patchy,Ref355,,1,COMP PR/RE,No,Ref355,It is expected that this boring crustacean will continue to spread north via shipping.,4,COMP PR/RE,"Ref355, Ref754",No known successful eradications. Prevention is key.
915,1,PR,Ref519,Competes with native species for resources.,4,PR,Locally patchy,Ref536,,2,PR,No,Ref536,A relatively quick expansion in Mediterranean from first sighted occurrence.,4,PR,Ref536,No known controls in marine environment.
916,2,PR,Ref509,"Within a decade of its first record in Haifa Bay, Israel, the Erythrean Spiny oyster, Spondylus spinosus Schreibers, 1793, has completely outcompeted the native congener S. gaederopus Linnaeus, 1758 (Mienis et al., 1993).",4,PR,Locally pervasive,Ref509,,1,PR,No,Ref509,Potential for spread from invaded sites.,4,PR,Ref509,No known controls in marine environment.
917,1,PR,"Ref537, Ref538","A competitively dominant species in rocky intertidal habitats. Outcompetes native mussel Perumytilus purpratus for space. Castilla et al. (2004) described it as an engineering species, creating dense three-dimensional matrices in broad belts, which modify the intertidal habitat structure. They found that 55% of the total 145 species recorded in the mid-intertidal habitat were found only in these matrices, which was especially apparent for macroinvertebrates,",4,PR,Locally pervasive,Ref537,,1,PR,No,Ref538,"Restricted to single bay in Chile - possibly due to shadow upwelling/water circulation retention mechanism. Potential for spread via shipping, fouling.",4,PR,Ref537,No known controls. Species provides eco-services in Chilean Bay.
918,3,PR,Ref519,"Cause PSP, diarrhetic shellfish poisoning, amnesic shellfish poisoning and ciguatera fish poisoning.
Impact economy by impacting fisheries, as well as human health and tourist activities.",4,PR,Locally pervasive,Ref519,,2,PR,No,Ref519,Potential for dispersal via shipping. Spreads via water currents.,4,PR,Ref519,No known controls in marine environment.
919,4,PR,Ref539,"Produce paralytic shellfish toxins. Impact native species, fisheries, tourism.",4,PR,Locally pervasive,Ref539,,2,PR,No,Ref539,Potential for continued transport via shipping.,4,PR,Ref539,No known controls in marine environment.
920,4,COMP PR/RE,Ref544,"This species has been associated with shellfish poisoning in Scandinavia (Jensen & Moestrup 1997), and one report of mussel Toxicity (as Pyrodinium phoneus) has been reported from Belgium (Woloszynska & Conrad 1939).",4,COMP PR/RE,Locally patchy,Ref544,,2,COMP PR/RE,Yes,Ref544,Potential for additional translocations via shipping.,4,COMP PR/RE,Ref544,No known controls in marine environment.
921,1,PR,"Ref541, Ref615","A. affine is considered non-toxic. HPLC analysis showed that A. affine isolated from Vietnamese waters was comprised of both toxic and non-toxic strains, but even in the toxic strain, toxicity per cell was very low. It can form blooms in areas of downwelling (Fraga and Bakun 1993), and its presence has been related to an increase in the surface temperature, river runoff, and rainfall (Wagey et al. 2000). Fraga et al. (1989) also argue that the chain-forming ability allows dinoflagellates like Alexandrium affine to dominate in waters with strong flows that disperse weaker-swimming species.
In Vietnam, marine shellfish culture is rapidly developing along the coast, and over 70% of cultured products are exported to European markets.",4,PR,Locally patchy,Ref541,,2,PR,Yes,Ref541,Potential for spread via shipping ballast. Spreads via water currents.,4,PR,Ref541,No known controls in marine environment.
922,2,PR,"Ref541, Ref615","C. monotis is not known to be toxic in the Mediterranean, but may be in different areas. Potential to impact aquaculture. Toxic blooms inhibit fisheries and tourism.",4,PR,Locally patchy,Ref543,,2,PR,No,Ref543,Potential for future translocations via shipping ballast.,4,PR,Ref543,No known controls in marine environment
923,4,PR,"Ref519, Ref544","Impact the economy by impacting fisheries, as well as human health and tourist activities. Known to cause shellfish mortalities in aquacultural facilities.
Red tide outbreaks have been considered responsible for inflammation of the upper respiratory tract and conjunctivitis in swimmers (Simoni et al., 2003, 2004).
This species can be tycoplanktonic, benthic or epiphytic (Steidinger & Tangen 1996).",4,PR,Locally patchy,Ref519,,2,PR,No,"Ref519, Ref542",,4,PR,Ref519,No known controls in marine environment.
924,3,PR,Ref545,"Became a dominant species in inshore fisheries. The sudden increase in the population of A. djeddaba may have been precipitated by the massive shoals of the nomadic jellyfish Rhopilema nomadica, as the former takes shelter among the latter’s nematocyst-laden tentacles (Galil et al., 1990).",4,PR,Regionally pervasive,Ref545,,2,PR,No,Ref545,Potential for migration from invaded sites.,3,PR,Ref545,Has become a significant fisheries resource.
925,4,PR,Ref545,"In the Levantine Basin, they feed almost exclusively on zoobenthos (Ogorek, 1999), and as such they compete with the native benthivorous fish species, altering the native food web.",4,PR,Locally pervasive,Ref545,,4,PR,No,Ref545,Spread within Mediterranean since introduction.,4,PR,Ref545,No known controls in marine environment
926,3,PR,Ref546,"Notorius for being highly venomous, with venom glands located along the dorsal and pectoral spines (GOLANI, 2002).
Competes with native species for resources.",4,PR,Locally patchy,Ref546,,3,PR,No,Ref546,Potential to continue to expand range in Mediterranean. A euryhaline species has potential to invade freshwater systems via estuaries.,4,PR,Ref546,No known controls in marine environment.
927,3,PR,Ref547,"Now among the most common fishes on the Lebanese rocky coast - more abundant between 12 and 32 m depth.
A macrocarnivore which outcompetes native species for resources. A nocturnal species.",4,PR,Locally pervasive,Ref547,,2,PR,No,"Ref547, Ref039",Potential to continue expansion in Mediterranean. Lack of nocturnal species in Mediterranean facilitates success of the colonization of S. rubrum.,4,PR,Ref547,No known controls in marine environment.
928,3,COMP PR/RE,Ref073,"De Groot (1927) reported that the toes and probing beaks of California Clapper Rails are frequently caught and clamped between the slightly gaping shells of Geukensia demissa that protrude from the mud. He noted that nearly every Clapper Rail that he'd examined in San Francisco Bay over the preceding twenty years was missing one or more toes and that others had had their beaks clamped shut and died of starvation. He estimated that an average of one or two chicks per brood were caught by mussels and drowned by the incoming tide, though he provided no numerical data to support this estimate. More recent observers have noted that Clapper Rails in San Francisco Bay are frequently missing one or more toes, and reported Clapper Rails with Geukensia demissa clamped to their toes or bills.
The most abundant bivalve in the wetland at Estero de Punda Banda, Baja California Norte, Mexico.",4,COMP PR/RE,Locally pervasive,Ref073,,3,COMP PR/RE,No,Ref073,"Planktonic larvae have potential to disperse in water column, expanding invasive range.",4,COMP PR/RE,Ref073,No successful eradication methods.
929,3,COMP PR/RE,"Ref039, Ref519",Associated with reports of ciguatera poisoning. Feeds on squids and fishes - competes with native species for resources.,4,COMP PR/RE,Locally patchy,Ref549,,3,COMP PR/RE,No,Ref549,Has reached significant biomasses in Mediterranean and is gradually expanding its distribution.,4,COMP PR/RE,Ref549,No known controls in marine environment.
930,3,PR,Ref550,"Compete with native species for resources. An economic burden to fishermen as these fish are caught in fishing gear and have to be discarded (Golani et al., 2002). 
Can be poisonous, due to its capacity to produce tetrodotoxin.",4,PR,Locally patchy,Ref550,,3,PR,No,Ref550,Believed to have migrated to Mediterranean through both Gibraltar Strait and Suez Canal. Strong potential for range expansion in Mediterranean.,4,PR,Ref550,No known controls in marine environment.
931,2,COMP PR/RE,Ref519,Competes with native species for resources.,4,COMP PR/RE,Locally patchy,Ref519,,2,COMP PR/RE,No,Ref519,Potential for range expansion within Mediterranean,4,COMP PR/RE,Ref519,No known controls in marine environment.
932,2,COMP PR/RE,Ref519,Competes with native species for resources.,4,COMP PR/RE,Locally patchy,Ref519,,3,COMP PR/RE,No,Ref519,Low potential for spreading without human assistance.,4,COMP PR/RE,Ref519,No known controls in aquatic environment.
933,2,PR,Ref519,Competes with native species for resources. Clogs/fouls hydro vents. Dense aggregations generate solid reefs. Thermal discharges may contribute to these aggregations.,4,PR,Locally patchy,Ref519,,1,PR,No,Ref519,Low potential to spread from site of invasion. Possibility of being carried on Levantine coastal currents. Most often transported on ships hulls and recreational boats.,4,PR,Ref519,"No known controls in aquatic environment. Foulding communities can be removed, but planktronic larvae remain to reestablish."
934,3,PR,Ref519,"Compete with native species for resources. Foul structures, thermal vents.",4,PR,Locally patchy,Ref519,,4,PR,No,Ref553,Combination of r-strategy and high genetic diversity may have contributed to the distinct colonizing ability in Mediterranean. High dispersal of young and high fecundity create a high potential for dispersal from invaded locations. Long lived pelagic larvae.,4,PR,Ref519,No known controls in marine environment.
935,4,COMP PR/RE,Ref073,"In San Francisco Bay has been found in densities over 100 and sometimes over 1,000 clams per square meter. Reported to have replaced populations of the native bent-nosed clame (Macoma nasuta) in San Francisco Bay - at least in regularly harvested clam beds.",4,COMP PR/RE,Locally pervasive,Ref073,,3,COMP PR/RE,No,Ref073,Widespread invasions of this species. Planktonic larvae spread locally from invaded sites.,4,COMP PR/RE,Ref073,No known controls in marine environment.
936,4,PR,Ref519,"The exploitation of the clam banks represents one of the main sources of environmental disturbance in the Venice Lagoon.
Known to be a host for parasite Perkinsus atlanticus in Ebro river delta.",4,COMP PR/RE,Locally pervasive,"Ref519, Ref031",,3,COMP PR/RE,No,Ref031,Spread via planktonic larvae. Potential to continue expansion in Mediterranean and other introduced areas.,4,PR,Ref519,No known controls in aquatic environment.
937,3,PR,Ref554,"Displaced M. galloprovincialis in intertidal upper rocky substrata in Spanish aqualutural facilities. Exhibit a rapid mobility and noticable adaptability to different habitat conditions. Spreads well and tolerates salinities of between 5 psu and 36-37 psu, which may be key factors contributing to its colonization of new habitats.
Displaces native species, fouls habitats
Considered to be one of the worst invasive alien species in Europe (SEBI2010).",4,PR,Locally pervasive,Ref554,,4,PR,No,Ref554,Potential for expansion from invaded regions via larval dispersal.,4,PR,Ref554,No known effective complete controls in marine environment.
938,2,COMP PR/RE,Ref575,Quickly recolonizes Tokyo Bay after summer hypoxia - enabling establishment prior to native species. Competes with natives for resources.,4,COMP PR/RE,Locally pervasive,Ref574,,2,COMP PR/RE,No,Ref576,"Larvae spreads in water currents. Also settles on oyster beds, with potential to spread via aquaculture.",4,COMP PR/RE,Ref574,Plantonic larvae inhibit complete eradication.
939,3,COMP PR/RE,Ref578,"Boring Sponges can form encrustations on mollusk shells, particularly oysters, and can burrow into the shell itself, weakening the shell and increasing the vulnerability to predators such as crabs and birds. In
more severe cases, Boring Sponges can kill the host mollusk and even completely dissolve the shell.
A fouling organism.",4,COMP PR/RE,Locally patchy,Ref578,,1,COMP PR/RE,No,Ref578,"Larvae are short lived in water column, so localized re-establishment is possible, but long distance dispersal must be facilitated by other means - shipping, oyster spat.",4,COMP PR/RE,Ref578,"There are no known methods for eradicating established
Boring Sponge populations."
940,3,COMP PR/RE,Ref578,"Once established, competition may restrict the establishment of other species. In turn, this may affect the recruitment and stability of other native and non-native species. 
Produces polyphenols that bind to proteins and make them relatively indigestible to grazers. Level of polyphenols increases as grazing pressure increases.",4,COMP PR/RE,Locally pervasive,Ref578,,3,COMP PR/RE,No,Ref578,"Has spread along the coast of the Pacific Northwest, but method is undefined. Asexual reproduction occurs through fragmentation, spreading via water currents.",4,COMP PR/RE,Ref578,"There are presently no methods of management or eradication
being implemented in sites where this species has invaded."
942,3,COMP PR/RE,Ref002,"Reduces native biodiversity. Displaces California native snail - Centidea californica. Success due to its resistance to parasites that affect C. californica.
Has helped increase eelgrass cover in Padilla Bay, Washington (USA). Also becomes the shelter for hermit crabs after its death.
Caused a significant change in Elkhorn Slough, (California, USA).",4,COMP PR/RE,Locally patchy,Ref002,,1,COMP PR/RE,No,Ref002,Low potential to expand range without human assistance.,3,COMP PR/RE,Ref002,Hand removal used to remove visible individuals.
943,3,COMP PR/RE,"Ref002, Ref581","Feeds on native molluscs and grasses. An extoparisitic species that feeds on internal parts of its prey.
Known to feed on odostomoid species Fargoa bartschi, Littorena littorea, Crassostrea virginica.
Said to have economic impacts from their predation and parasitism on commercially important shellfish in San Francisco Bay.",4,COMP PR/RE,Locally patchy,Ref002,,1,COMP PR/RE,No,Ref002,Low potential for spread without human assistance. Larvae may spread locally.,3,COMP PR/RE,Ref002,No known complete eradication methods in aquatic environment. Can be controlled with intense monitoring.
944,3,COMP PR/RE,Ref002,"An oyster driller that destroys populations of oysters, especially Crassostrea gigas. In stocked oyster bed populations it causes 25% mortality. Production costs increase (~20%) and the profits decrease (~55%) because of C. inornatum (Elston, 1997).",4,COMP PR/RE,Locally pervasive,Ref002,,1,COMP PR/RE,No,Ref002,"Does not migrate by itself, human assisted transport is required.",3,COMP PR/RE,Ref002,"Hand removal, burning removes eggs from oysters."
945,3,COMP PR/RE,Ref002,"May impact native estuarine communities by competing for space and resources with native crabs. As it transmits disease and preys on native shellfish it is a potential threat to fisheries and traditional shell-fishing. Disease transmission is one of the key potential impacts of the paddle crab in introduced environments. C. japonica is known to be a host or carrier of the White Spot Syndrome Virus.
An opportunistic predator of bivalves, fish, cephalopods and other benthic invertebrates.",4,COMP PR/RE,Locally pervasive,Ref002,,1,COMP PR/RE,No,Ref002,Low potential for spread without human assistance.,3,COMP PR/RE,Ref002,Prevention is best management. Crab pots can be used to capture individuals. Potential to attract this species to crab pots for capture using saccharides as bait.
946,3,COMP PR/RE,Ref002,"Displaces and competes for resources with native species. Has shown under a variety of labaratory conditions to increase the larval settlement of another species of clam, Mercenaria mercenaria (Ahn, 1993). Preferential settlement of M. mercenaria increased with increasing density of G. gemma in the sediment, suggesting that the gem clam alters the environment in some way that benefits larval settlement of other species (Ahn, 1993).",4,COMP PR/RE,Locally patchy,Ref002,,3,COMP PR/RE,No,Ref002,"Relies on passive transport mechanisms: tidal cycles, sediment bedload transport, storm deposition and other human assisted transport. The gem clam dispersion is highly dependent on sediment bedload transport, a passive transport mechanism which can result from many different causes. Another dispersal mechanism can result from high-density pressures leading to passive migration from tidal cycles that disperse juveniles to local low-density areas (Commito et al. 1995).",3,COMP PR/RE,Ref002,"Prevention, education, integrated management can stabilize invasive populations to prevent overwhelming native populations."
947,3,COMP PR/RE,Ref039,Doubling time fo this species estimated between 1.4 and 4.4 years. Form huge schools in Hawaiian waters. May compete with native red snapper species in Hawaiian waters. Could be a seriously destabilizing influence.,4,COMP PR/RE,Locally patchy,Ref002,,3,COMP PR/RE,No,Ref002,A marine species with potential to spread from invaded locations via natural dispersal or water currents.,4,COMP PR/RE,Ref002,No management information located for species in open water.
948,3,COMP PR/RE,"Ref002, Ref005, Ref039","Chameleon goby have specific habitat requirements and it is therefore possible that they will compete with species sharing their preferred habitat (NIMPIS 2006).
Doubling time less than 15 months.
Recently, chameleon goby populations in San Francisco Bay have plummeted, possibly because of predation by yellowfin gobies (Meng et al. 1994). Because adults spawn 3-4 months after the piscivorous yellowfin goby, their young are vulnerable (Wang 1986).",4,COMP PR/RE,Locally patchy,Ref002,,1,COMP PR/RE,No,Ref002,"May disperse from current locations, but more likely to be transported with human assistance.",2,COMP PR/RE,Ref002,No known controls in marine environment. Has not become a sufficient problem to require management.
