layer,dir_prep,fn_data,ingest,name_data_fld,targets,name,units,description
ao_closures,ohibc:prep/ao/v2017/output,ao_closures.csv,TRUE,days_avg,AO,Shellfish closure days area-weighted by region as a proxy for access to shellfish gardens,,
ao_licenses,ohibc:prep/ao/v2017/output,ao_licenses.csv,TRUE,n_fn,AO,Commercial fishing licenses total and proportion allocated to First Nations as a measure of access to commercial fisheries,,
ao_salmon,ohibc:prep/ao/v2017/output,ao_salmon.csv,TRUE,days_avg,AO,Salmon stock health as a proxy for access to salmon for FSC purposes,,
ao_spawn_hab_index,ohibc:prep/ao/v2017/output,ao_spawn_hab_index.csv,TRUE,shi_tot,AO,Herring spawn habitat index as a proxy for opportunity to collect herring spawn,,
cc_acid,ohibc:calc_ohibc/master/dummy_layers,cc_acid_gl2016.csv,TRUE,pressure_score,pressure,Ocean acidification,scaled 0-1,Ocean acidification pressure scaled using biological thresholds
cc_slr,ohibc:calc_ohibc/master/dummy_layers,cc_slr_gl2016.csv,TRUE,pressure_score,pressure,Sea level rise,scaled 0-1,Sea level rise pressure
cc_sst,ohibc:calc_ohibc/master/dummy_layers,cc_sst_gl2016.csv,TRUE,pressure_score,pressure,Sea surface temperature anomolies,scaled 0-1,Sea surface temperature anomolies
cc_uv,ohibc:calc_ohibc/master/dummy_layers,cc_uv_gl2016.csv,TRUE,pressure_score,pressure,UV radiation pressure,scaled 0-1,Modeled UV radiation based on Erythemal UV Irradiance data provided by GES DISC.
cp_cf_health,ohibc:prep/hab_cs_cp/v2017/output,cp_cf_exposure.csv,TRUE,cf_expos_area_tot,CP,Exposure-weighted coastal forest habitat condition,proportion,Current condition of coastal forest habitat relative to historical condition weighted by exposure
cp_sm_health,ohibc:prep/hab_cs_cp/v2017/output,cp_sm_exposure.csv,TRUE,sm_expos_area_tot,CP,Exposure-weighted salt marsh habitat condition,proportion,Current condition of salt marsh habitat relative to historical condition weighted by exposure
cw_chemical_trend,ohibc:calc_ohibc/master/dummy_layers,wgi_all_gl2016.csv,TRUE,resilience_score,CW,Chemical pollution trend,trend,"Modeled chemical pollution from commercial shipping traffic, ports and harbors, and pesticide use"
cw_nutrient_trend,ohibc:calc_ohibc/master/dummy_layers,wgi_all_gl2016.csv,TRUE,resilience_score,CW,Nutrient pollution trend,trend,Modeled data based on fertilizer consumption as a proxy for nutrient pollution
cw_pathogen_trend,ohibc:calc_ohibc/master/dummy_layers,wgi_all_gl2016.csv,TRUE,resilience_score,CW,Pathogen pollution trend,trend,Trends in percent of population without access to improved sanitation facilities as a proxy for pathogen pollution
cw_trash_trend,ohibc:calc_ohibc/master/dummy_layers,wgi_all_gl2016.csv,TRUE,resilience_score,CW,Plastic trash trends,trend,Trends in trash estimated using improperly disposed of plastics
element_wts_cp_km2_x_protection,ohibc:calc_ohibc/master/dummy_layers,element_wts_cp_km2_x_protection_gl2016.csv,TRUE,extent_rank,pressure resilience,Coastal protection weights,extent*rank,"Habitat extent multiplied by habitat protection rank for: coral, mangrove (offshore and inland 1km), saltmarsh, sea ice (shoreline), and seagrass"
element_wts_cs_km2_x_storage,ohibc:calc_ohibc/master/dummy_layers,element_wts_cs_km2_x_storage_gl2016.csv,TRUE,extent_rank,pressure resilience,Carbon storage weights,extent*storage,"Habitat extent multiplied by carbon storage capacity for:  mangrove (offshore and inland 1km), saltmarsh, and sea ice"
element_wts_hab_pres_abs,ohibc:calc_ohibc/master/dummy_layers,element_wts_hab_pres_abs_gl2016.csv,TRUE,boolean,pressure resilience,Habitat weights,boolean,List of habitats in each region
fis_ram_b_bmsy,ohibc:prep/fis/v2017/output,ram_b_bmsy.csv,TRUE,value,FIS,B/Bmsy estimates obtained using RAM data,B/Bmsy,The ratio of fish population abundance compared to the abundance required to deliver maximum sustainable yield
fis_ram_f_fmsy,ohibc:prep/fis/v2017/output,ram_f_fmsy.csv,TRUE,value,FIS,F/Fmsy estimates obtained using RAM data,F/Fmsy,The ratio of fishery harvest relative to the fishery harvest at maximum sustainable yield
fis_ram_catch,ohibc:prep/fis/v2017/output,ram_catch.csv,TRUE,value,FIS,Catch estimates obtained using RAM data,tonnes,Estimate of total annual catch for a given fishery
fis_stock_wt_dfo,ohibc:prep/fis/v2017/output,rgn_stock_wt_dfo.csv,TRUE,catch_wt,FIS,Catch weighting of RAM stocks between OHIBC regions per DFO data,proportion,Spatialized catch weighting of total catch of RAM stock across OHIBC regions according to DFO-reported catch
fis_stock_wt_saup,ohibc:prep/fis/v2017/output,rgn_stock_wt_saup.csv,TRUE,catch_wt,FIS,Catch weighting of RAM stocks between OHIBC regions per SAUP data,proportion,Spatialized catch weighting of total catch of RAM stock across OHIBC regions according to SAUP-reported catch
fis_stock_wt_src,ohibc:prep/fis/v2017/raw,ram_dfo_saup_lookup.csv,TRUE,priority,FIS,Lookup table of RAM stock to spatial distribution data,NA,Lookup table of RAM stock to preferred spatial data source (DFO data or SAUP data)
fp_art_hb,ohibc:calc_ohibc/master/dummy_layers,fp_art_hb_gl2016placeholder.csv,TRUE,pressure_score,pressure,High bycatch due to artisanal fishing,scaled 0-1,The presence of destructive artisanal blast and poison (cyanide) fishing.
fp_art_lb,ohibc:calc_ohibc/master/dummy_layers,fp_art_lb_gl2016.csv,TRUE,pressure_score,pressure,Low bycatch due to artisanal fishing,scaled 0-1,"Extent of artisanal fishing (including: artisanal, subsistence, and recreational catch)"
fp_com_hb,ohibc:calc_ohibc/master/dummy_layers,fp_com_hb_gl2016.csv,TRUE,pressure_score,pressure,High bycatch due to commercial fishing,scaled 0-1,Modeled destructive commercial fishing practices by 5 gear types and scaled by Net Primary Productivity
fp_com_lb,ohibc:calc_ohibc/master/dummy_layers,fp_com_lb_gl2016.csv,TRUE,pressure_score,pressure,Low bycatch due to commercial fishing,scaled 0-1,Modeled destructive commercial fishing practices by 2 gear types and scaled by Net Primary Productivity
fp_habitat,ohibc:calc_ohibc/master/dummy_layers,fp_habitat_gl2016.csv,TRUE,resilience_score,resilience,Management and protection of habitat to preserve biodiversity (fisheries),scaled 0-1,Survey responses by country to the Convention on Biologicial Diversity (CBD) Third National Report: habitat related questions
fp_mora,ohibc:calc_ohibc/master/dummy_layers,fp_mora_gl2016.csv,TRUE,value,resilience,Commercial fishing management,scaled 0-1,Regulations and management of commerical fishing
fp_mora_artisanal,ohibc:calc_ohibc/master/dummy_layers,fp_mora_artisanal_gl2016.csv,TRUE,value,resilience,Artisanal fisheries management effectiveness and opportunity,scaled 0-1,The opportunity for artisanal and recreational fishing based on the quality of management of the small-scale fishing sector
fp_mpa_coast,ohibc:calc_ohibc/master/dummy_layers,fp_mpa_coast_gl2016.csv,TRUE,resilience_score,resilience,Coastal protected marine areas to protect fishery resources,scaled 0-1,Protected marine areas within 3nm of coastline (lasting special places goal calculated for coastal zone)
fp_mpa_eez,ohibc:calc_ohibc/master/dummy_layers,fp_mpa_eez_gl2016.csv,TRUE,resilience_score,resilience,EEZ protected marine areas to protect fishery resources,scaled 0-1,Protected marine areas within EEZ to protect fishery resource (lasting special places goal results)
fp_targetharvest,ohibc:calc_ohibc/master/dummy_layers,fp_targetharvest_gl2016.csv,TRUE,pressure_score,pressure,Targeted harvest of cetaceans and marine turtles,scaled 0-1,Targeted harvest of cetaceans and marine turtles
fp_wildcaught_weight,ohibc:calc_ohibc/master/dummy_layers,wgi_all_gl2016.csv,TRUE,resilience_score,FP,Food provision weights,proportion,Proportion of wild caught fisheries to mariculture
g_cites,ohibc:calc_ohibc/master/dummy_layers,g_cites_gl2016.csv,TRUE,resilience_score,resilience,CITES signatories,scaled 0-1,Convention on International Trade in Endangered Species of Wild Fauna and Flora (CITES) signatories
g_mariculture,ohibc:calc_ohibc/master/dummy_layers,g_mariculture_gl2016.csv,TRUE,resilience_score,resilience,Management of mariculture practices to preserve biodiversity,scaled 0-1,Survey responses by country to the Convention on Biologicial Diversity (CBD) Third National Report: mariculture related questions
g_msi_gov,ohibc:calc_ohibc/master/dummy_layers,g_msi_gov_gl2016.csv,TRUE,resilience_score,resilience,Mariculture Sustainability Index,scaled 0-1,Mariculture practice assessment criteria from the Mariculture Sustainability Index (MSI)
g_tourism,ohibc:calc_ohibc/master/dummy_layers,g_tourism_gl2016.csv,TRUE,resilience_score,resilience,Management of tourism to preserve biodiversity,scaled 0-1,Survey responses by country to the Convention on Biologicial Diversity (CBD) Third National Report: tourism related questions
hab_cf_health,ohibc:prep/hab_cs_cp/v2017/output,hab_cf_area.csv,TRUE,cf_area_km2,HAB CS,Coastal forest habitat condition,proportion,Current condition of coastal forest habitat relative to historical condition
hab_ebsa_health,ohibc:prep/hab_cs_cp/v2017/output,hab_ebsa_trawl.csv,TRUE,trawled_area,HAB CP CS,EBSA habitat condition,trawled area,Current condition of EBSA habitat based on trawled area
hab_extent,ohibc:calc_ohibc/master/dummy_layers,wgi_all_gl2016.csv,TRUE,resilience_score,HAB CP CS,Habitat extent,km2,"Area of habitats: mangrove, saltmarsh, seagrass, soft-bottom, seaice, coral"
hab_sb_health,ohibc:prep/hab_cs_cp/v2017/output,hab_soft_btm_trawl.csv,TRUE,mean_hr_area,HAB CP CS,Soft Bottom habitat condition,proportion,Current condition of soft bottom habitat based on trawl effort
hab_sm_health,ohibc:prep/hab_cs_cp/v2017/output,hab_sm_area.csv,TRUE,sm_area_km2,HAB CS,Salt marsh habitat condition,proportion,Current condition of salt marsh habitat relative to historical condition
hab_trend,ohibc:calc_ohibc/master/dummy_layers,wgi_all_gl2016.csv,TRUE,resilience_score,HAB CP CS,Habitat condition trend,trend,Estimated change in habitat condition during most recent 5 years
hd_habitat,ohibc:calc_ohibc/master/dummy_layers,hd_habitat_gl2016.csv,TRUE,resilience_score,pressure,Management and protection of habitat to preserve biodiversity,scaled 0-1,Survey responses by country to the Convention on Biologicial Diversity (CBD) Third National Report: habitat related questions
hd_intertidal,ohibc:calc_ohibc/master/dummy_layers,hd_intertidal_gl2016.csv,FALSE,pressure_score,pressure,Intertidal habitat destruction,scaled 0-1,Coastal population density (25 mi from shore)  as a proxy for intertidal habitat destruction
hd_mpa_coast,ohibc:calc_ohibc/master/dummy_layers,hd_mpa_coast_gl2016.csv,TRUE,resilience_score,resilience,Coastal protected marine areas to protect against habitat destruction,scaled 0-1,Protected marine areas within 3nm of coastline (lasting special places goal status score)
hd_mpa_eez,ohibc:calc_ohibc/master/dummy_layers,hd_mpa_eez_gl2016.csv,TRUE,resilience_score,resilience,Protected marine areas within EEZ to protect against habitat destruction,scaled 0-1,Protected marine areas within EEZ (lasting special places status score for entire EEZ)
hd_subtidal_hb,ohibc:calc_ohibc/master/dummy_layers,hd_subtidal_hb_gl2016placeholder.csv,TRUE,score,pressure,Subtidal hardbottom habitat destruction,scaled 0-1,High bycatch artisanal fishing practices (blast fishing) as a proxy for subtidal hard bottom habitat destruction
hd_subtidal_sb,ohibc:calc_ohibc/master/dummy_layers,hd_subtidal_sb_gl2016.csv,TRUE,pressure_score,pressure,Subtidal softbottom habitat destruction,scaled 0-1,"Demersal destructive commercial fishing practices (i.e., trawling) in softbottom habitat as a proxy for soft bottom habitat destruction"
ico_spp_risk_score,ohibc:prep/spp_ico/v2017/output,ico_risk_by_year.csv,TRUE,risk_score,ICO,IUCN or BCSEE extinction risk score,IUCN or BCSEE risk category score,IUCN or BCSEE scored extinction risk category for iconic species per assessment year
ico_spp_presence,ohibc:prep/spp_ico/v2017/output,ico_spp_by_rgn.csv,TRUE,rgn_id,ICO,Region ID,ICO spp presence within OHIBC regions,List of iconic species and the regions in which they are found according to IUCN or Aquamaps
le_gdp,ohibc:calc_ohibc/master/dummy_layers,wgi_all_gl2016.csv,TRUE,resilience_score,LE,GDP,2012 USD,Gross Domestic Product (GDP)
le_gdp_pc_ppp,ohibc:calc_ohibc/master/dummy_layers,wgi_all_gl2016.csv,TRUE,resilience_score,LE,GDP per capita PPP,USD,Gross domestic product per person at purchasing power parity
le_jobs_cur_adj_value,ohibc:calc_ohibc/master/dummy_layers,wgi_all_gl2016.csv,TRUE,resilience_score,LE,Current jobs adjusted,value,Modeled LE data
le_jobs_cur_base_value,ohibc:calc_ohibc/master/dummy_layers,wgi_all_gl2016.csv,TRUE,resilience_score,LE,Current jobs base,value,Modeled LE data
le_jobs_ref_adj_value,ohibc:calc_ohibc/master/dummy_layers,wgi_all_gl2016.csv,TRUE,resilience_score,LE,Reference jobs adjusted,value,Modeled LE data
le_jobs_ref_base_value,ohibc:calc_ohibc/master/dummy_layers,wgi_all_gl2016.csv,TRUE,resilience_score,LE,Reference jobs base,value,Modeled LE data
le_jobs_sector_year,ohibc:calc_ohibc/master/dummy_layers,wgi_all_gl2016.csv,TRUE,resilience_score,LE,Jobs,number of jobs,Modeled LE data
le_popn,ohibc:calc_ohibc/master/dummy_layers,wgi_all_gl2016.csv,TRUE,resilience_score,LE,Total human population,number of people,Human population of OHI regions
le_rev_cur_adj_value,ohibc:calc_ohibc/master/dummy_layers,wgi_all_gl2016.csv,TRUE,resilience_score,LE,Current revenue adjusted,value,Modeled LE data
le_rev_cur_base_value,ohibc:calc_ohibc/master/dummy_layers,wgi_all_gl2016.csv,TRUE,resilience_score,LE,Current revenue base,value,Modeled LE data
le_rev_ref_adj_value,ohibc:calc_ohibc/master/dummy_layers,wgi_all_gl2016.csv,TRUE,resilience_score,LE,Reference revenue adjusted,value,Modeled LE data
le_rev_ref_base_value,ohibc:calc_ohibc/master/dummy_layers,wgi_all_gl2016.csv,TRUE,resilience_score,LE,Reference revenue base,value,Modeled LE data
le_rev_sector_year,ohibc:calc_ohibc/master/dummy_layers,wgi_all_gl2016.csv,TRUE,resilience_score,LE,Revenue,2010 USD,Modeled LE data
le_revenue_adj,ohibc:calc_ohibc/master/dummy_layers,wgi_all_gl2016.csv,TRUE,resilience_score,LE,Revenue adjusted,USD,Modeled LE data
le_sector_weight,ohibc:calc_ohibc/master/dummy_layers,le_sector_weight_gl2016.csv,TRUE,weight,LE,Sector weight by jobs,value,Proportion of jobs within each sector
le_unemployment,ohibc:calc_ohibc/master/dummy_layers,wgi_all_gl2016.csv,TRUE,resilience_score,LE,Unemployment,proportion,Modeled LE data
le_wage_cur_adj_value,ohibc:calc_ohibc/master/dummy_layers,wgi_all_gl2016.csv,TRUE,resilience_score,LE,Current wages adjusted,value,Modeled LE data
le_wage_cur_base_value,ohibc:calc_ohibc/master/dummy_layers,wgi_all_gl2016.csv,TRUE,resilience_score,LE,Current wages base,value,Modeled LE data
le_wage_ref_adj_value,ohibc:calc_ohibc/master/dummy_layers,wgi_all_gl2016.csv,TRUE,resilience_score,LE,Reference wages adjusted,value,Modeled LE data
le_wage_ref_base_value,ohibc:calc_ohibc/master/dummy_layers,wgi_all_gl2016.csv,TRUE,resilience_score,LE,Reference wages base,value,Modeled LE data
le_wage_sector_year,ohibc:calc_ohibc/master/dummy_layers,wgi_all_gl2016.csv,TRUE,resilience_score,LE,Wages,2010 USD,Modeled LE data
le_workforcesize_adj,ohibc:calc_ohibc/master/dummy_layers,wgi_all_gl2016.csv,TRUE,resilience_score,LE,Adjusted workforce size,number of jobs,Modeled LE data
li_gci,ohibc:calc_ohibc/master/dummy_layers,li_gci_gl2016.csv,TRUE,score,resilience,Competitiveness in achieving sustained economic prosperity,scaled,Global Competitiveness Index (GCI) scores from the World Economic Forum
li_sector_evenness,ohibc:calc_ohibc/master/dummy_layers,li_sector_evenness_gl2016.csv,TRUE,resilience_score,resilience,Sector evenness as a measure of economic diversity,scaled,Shannon's Diversity Index calculated sector evenness based on the total number of sectors and the proportion of jobs belonging to any sector
lsp_prot_area_inland_ws,ohibc:prep/lsp/v2017/output,lsp_protected_inland_ws.csv,TRUE,a_prot_inland,LSP,Inland coastal protected areas,km2,Protected areas located 1 km inland
lsp_prot_area_offshore3nm,ohibc:prep/lsp/v2017/output,lsp_protected_offshore3nm.csv,TRUE,a_prot_3nm,LSP,Offshore coastal protected areas,km2,Protected areas located 3nm offshore
lsp_tot_area_inland_ws,ohibc:prep/lsp/v2017/output,lsp_a_total_inland_ws.csv,TRUE,a_tot_inland,LSP,Inland area,km2,Inland area of OHI regions within 1km of shoreline
lsp_tot_area_offshore3nm,ohibc:prep/lsp/v2017/output,lsp_a_total_offshore3nm.csv  ,TRUE,a_tot_3nm,LSP,Offshore area,km2,Offshore area of OHI regions within 3nm of shoreline
mar_coastalpopn_inland25mi,ohibc:calc_ohibc/master/dummy_layers,wgi_all_gl2016.csv,TRUE,resilience_score,MAR,Inland coastal population,number of people,Total coastal population within 25 miles of coast.
mar_harvest_tonnes,ohibc:calc_ohibc/master/dummy_layers,wgi_all_gl2016.csv,TRUE,resilience_score,MAR,Mariculture harvest,tonnes,Tonnes of mariculture harvest
mar_sustainability_score,ohibc:calc_ohibc/master/dummy_layers,wgi_all_gl2016.csv,TRUE,resilience_score,MAR,Mariculture sustainability score,score,Mariculture sustainability from the Mariculture Sustainability Index (MSI).
po_chemical,ohibc:prep/cw/v2017/output,po_chemical.csv,TRUE,chem_pressure,pressure,Chemical pollution,scaled 0-1,"Modeled chemical pollution from commercial shipping traffic, ports and harbors, and pesticide use"
po_chemical_3nm,ohibc:prep/cw/v2017/output,po_chemical_3nm.csv,TRUE,chem_pressure,CW pressure,Coastal chemical pollution,scaled 0-1,"Modeled chemical pollution from commercial shipping traffic, ports and harbors, land-based pesticide use (organic pollution), and urban runoff (inorganic pollution)"
po_nutrient,prep/cw/v2017/output,po_nutrient.csv,TRUE,nutr_pressure,pressure,Nutrient pollution,scaled 0-1,Modeled data based on fertilizer consumption from the Food and Agricultural Organization
po_nutrient_3nm,ohibc:prep/cw/v2017/output,po_nutrient_3nm.csv,TRUE,nutr_pressure,CW pressure,Coastal nutrient pollution,scaled 0-1,Modeled data based on fertilizer consumption from the Food and Agricultural Organization
po_pathogens_closures,ohibc:prep/ao/v2017/output,ao_closures.csv,TRUE,days_avg,CW pressure,Pathogen pollution,scaled 0-1,Area-weighted closure days due to all causes (biotoxins chemical sanitation)
po_trash,ohibc:prep/cw/v2017/output,po_trash.csv,TRUE,trash_pressure,CW pressure,Marine plastics,scaled 0-1,Global marine plastics
po_water,ohibc:calc_ohibc/master/dummy_layers,po_water_gl2016.csv,TRUE,resilience_score,pressure,Management and regulations to control water pollution to preserve biodiversity,scaled 0-1,Survey responses by country to the Convention on Biologicial Diversity (CBD) Third National Report: tourism related questions
res_spi,ohibc:calc_ohibc/master/dummy_layers,res_spi_gl2016.csv,FALSE,resilience_score,resilience,Social Progress Index,scaled 0-1,Social Progress Index scores
rgn_area,ohibc:calc_ohibc/master/dummy_layers,rgn_area.csv,TRUE,area_km2,spatial,Region areas based on EEZ boundaries,km2,Area of Ocean Health Index regions modified from exclusive economic zones
rgn_labels,ohibc:calc_ohibc/master/dummy_layers,rgn_labels.csv,TRUE,label,spatial,Regions,label,"Regions by type (eez, subocean, unclaimed)"
sp_alien,ohibc:calc_ohibc/master/dummy_layers,sp_alien_gl2016.csv,TRUE,pressure_score,pressure,Nonindigenous species,scaled 0-1,Measure of harmful invasive species
sp_alien_species,ohibc:calc_ohibc/master/dummy_layers,sp_alien_species_gl2016.csv,TRUE,resilience_score,resilience,Management of nonindigenous species,scaled 0-1,Survey responses by country to the Convention on Biologicial Diversity (CBD) Third National Report: invasive species related questions
sp_genetic,ohibc:calc_ohibc/master/dummy_layers,sp_genetic_gl2016.csv,TRUE,pressure_score,pressure,Genetic escapes,scaled 0-1,Introduced mariculture species (Mariculture Sustainability Index) as a proxy for genetic escapes
species_diversity_3nm,ohibc:prep/spp_ico/v2017/output,spp_status_3nm.csv,TRUE,status,resilience,Measure of coastal ecological integrity,scaled 0-1,Marine species condition (same calculation and data as the species subgoal status score)  calculated within 3 nm of shoreline as a proxy for ecological integrity
spp_risk_scores,ohibc:prep/spp_ico/v2017/output,spp_risk_by_year.csv,TRUE,risk_score,SPP,Species risk category score,rescaled category score,Species risk score based on IUCN Red List extinction risk category
spp_pop_trends,ohibc:prep/spp_ico/v2017/output,spp_trend_by_id.csv,TRUE,pop_trend,SPP,Species population trend,'stable' 'increasing' or 'decreasing',Species population trend based on most recent IUCN Red List assessment
spp_range_areas,ohibc:prep/spp_ico/v2017/output,spp_area_by_rgn.csv,TRUE,spp_pct_area,SPP,Species range as pct of region,percent of area,Species range as a percent of region area as determined by IUCN or AquaMaps range maps
ss_spi,ohibc:calc_ohibc/master/dummy_layers,ss_spi_gl2016.csv,FALSE,pressure_score,pressure,Weakness of social progress,scaled 0-1,Inverse of Social Progress Index scores
ss_wgi,ohibc:calc_ohibc/master/dummy_layers,ss_wgi_gl2016.csv,TRUE,pressure_score,pressure,Weakness of governance,scaled 0-1,Inverse of World Governance Indicators (WGI) six combined scores
tr_jobs_pct_tourism,ohibc:calc_ohibc/master/dummy_layers,wgi_all_gl2016.csv,TRUE,resilience_score,TR,Percent direct employment in tourism,proportion,Percent direct employment in tourism
tr_sustainability,ohibc:calc_ohibc/master/dummy_layers,wgi_all_gl2016.csv,TRUE,resilience_score,TR,Tourism sustainability index,score,Tourism Competitiveness Index (TTCI)
tr_travelwarnings,ohibc:calc_ohibc/master/dummy_layers,wgi_all_gl2016.csv,TRUE,resilience_score,TR,US State Department travel warnings,score,Countries with US State Department travel warnings
wgi_all,ohibc:calc_ohibc/master/dummy_layers,wgi_all_gl2016.csv,TRUE,resilience_score,resilience,Strength of governance,scaled 0-1,World Governance Indicators (WGI) six combined scores
